CUSTOMER|1|711.56|IVhzIApeRb ot,c,E|0|0|0|to the even, regular platelets. regular, ironic epitaphs nag e|0|0|1|0|0|0|0|0|BUILDING|Customer#000000001|15|0|0|0|0|0|25-989-741-2988|0|0|0|0|0|0|0|0|0|0|0|0|0|0|0
CUSTOMER|1|121.65|XSTf4,NCwDVaWNe6tEgvwfmRchLXak|0|0|0|l accounts. blithely ironic theodolites integrate boldly: caref|0|0|2|0|0|0|0|0|AUTOMOBILE|Customer#000000002|13|0|0|0|0|0|23-768-687-3665|0|0|0|0|0|0|0|0|0|0|0|0|0|0|0
CUSTOMER|1|7498.12|MG9kdTD2WBHm|0|0|0| deposits eat slyly ironic, even instructions. express foxes detect slyly. blithely even accounts abov|0|0|3|0|0|0|0|0|AUTOMOBILE|Customer#000000003|1|0|0|0|0|0|11-719-748-3364|0|0|0|0|0|0|0|0|0|0|0|0|0|0|0
CUSTOMER|1|2866.83|XxVSJsLAGtn|0|0|0| requests. final, regular ideas sleep final accou|0|0|4|0|0|0|0|0|MACHINERY|Customer#000000004|4|0|0|0|0|0|14-128-190-5944|0|0|0|0|0|0|0|0|0|0|0|0|0|0|0
CUSTOMER|1|794.47|KvpyuHCplrB84WgAiGV6sYpZq7Tj|0|0|0|n accounts will have to unwind. foxes cajole accor|0|0|5|0|0|0|0|0|HOUSEHOLD|Customer#000000005|3|0|0|0|0|0|13-750-942-6364|0|0|0|0|0|0|0|0|0|0|0|0|0|0|0
CUSTOMER|1|7638.57|sKZz0CsnMD7mp4Xd0YrBvx,LREYKUWAh yVn|0|0|0|tions. even deposits boost according to the slyly bold packages. final accounts cajole requests. furious|0|0|6|0|0|0|0|0|AUTOMOBILE|Customer#000000006|20|0|0|0|0|0|30-114-968-4951|0|0|0|0|0|0|0|0|0|0|0|0|0|0|0
CUSTOMER|1|9561.95|TcGe5gaZNgVePxU5kRrvXBfkasDTea|0|0|0|ainst the ironic, express theodolites. express, even pinto beans among the exp|0|0|7|0|0|0|0|0|AUTOMOBILE|Customer#000000007|18|0|0|0|0|0|28-190-982-9759|0|0|0|0|0|0|0|0|0|0|0|0|0|0|0
CUSTOMER|1|6819.74|I0B10bB0AymmC, 0PrRYBCP1yGJ8xcBPmWhl5|0|0|0|among the slyly regular theodolites kindle blithely courts. carefully even theodolites haggle slyly along the ide|0|0|8|0|0|0|0|0|BUILDING|Customer#000000008|17|0|0|0|0|0|27-147-574-9335|0|0|0|0|0|0|0|0|0|0|0|0|0|0|0
CUSTOMER|1|8324.07|xKiAFTjUsCuxfeleNqefumTrjS|0|0|0|r theodolites according to the requests wake thinly excuses: pending requests haggle furiousl|0|0|9|0|0|0|0|0|FURNITURE|Customer#000000009|8|0|0|0|0|0|18-338-906-3675|0|0|0|0|0|0|0|0|0|0|0|0|0|0|0
CUSTOMER|1|2753.54|6LrEaV6KR6PLVcgl2ArL Q3rqzLzcT1 v2|0|0|0|es regular deposits haggle. fur|0|0|10|0|0|0|0|0|HOUSEHOLD|Customer#000000010|5|0|0|0|0|0|15-741-346-9870|0|0|0|0|0|0|0|0|0|0|0|0|0|0|0
CUSTOMER|1|-272.6|PkWS 3HlXqwTuzrKg633BEi|0|0|0|ckages. requests sleep slyly. quickly even pinto beans promise above the slyly regular pinto beans.|0|0|11|0|0|0|0|0|BUILDING|Customer#000000011|23|0|0|0|0|0|33-464-151-3439|0|0|0|0|0|0|0|0|0|0|0|0|0|0|0
CUSTOMER|1|3396.49|9PWKuhzT4Zr1Q|0|0|0| to the carefully final braids. blithely regular requests nag. ironic theodolites boost quickly along|0|0|12|0|0|0|0|0|HOUSEHOLD|Customer#000000012|13|0|0|0|0|0|23-791-276-1263|0|0|0|0|0|0|0|0|0|0|0|0|0|0|0
CUSTOMER|1|3857.34|nsXQu0oVjD7PM659uC3SRSp|0|0|0|ounts sleep carefully after the close frays. carefully bold notornis use ironic requests. blithely|0|0|13|0|0|0|0|0|BUILDING|Customer#000000013|3|0|0|0|0|0|13-761-547-5974|0|0|0|0|0|0|0|0|0|0|0|0|0|0|0
CUSTOMER|1|5266.3|KXkletMlL2JQEA |0|0|0|, ironic packages across the unus|0|0|14|0|0|0|0|0|FURNITURE|Customer#000000014|1|0|0|0|0|0|11-845-129-3851|0|0|0|0|0|0|0|0|0|0|0|0|0|0|0
CUSTOMER|1|2788.52|YtWggXoOLdwdo7b0y,BZaGUQMLJMX1Y,EC,6Dn|0|0|0| platelets. regular deposits detect asymptotes. blithely unusual packages nag slyly at the fluf|0|0|15|0|0|0|0|0|HOUSEHOLD|Customer#000000015|23|0|0|0|0|0|33-687-542-7601|0|0|0|0|0|0|0|0|0|0|0|0|0|0|0
ORDERS|1|0|0|0|0|Clerk#000000951|nstructions sleep furiously among|0|0|10|0|0|0|0|0|0|0|0|19960102|1|5-LOW|O|0|0|0|0|0|0|0|0|0|0|0|0|0|0|0|131251.81|0
