1594|0|2178|8|O|79594.68|1996-12-12|3-MEDIUM|Clerk#000000656|0|thely according to the instructions. furious
1595|1|4256|118|F|23067.48|1992-04-05|4-NOT SPECIFIED|Clerk#000000043|0|y alongside of the fluffily iro
1595|0|3239|35|O|156802.80|1998-01-12|4-NOT SPECIFIED|Clerk#000000619|0| cajole carefully along the furiously pending deposits. 
1596|1|4257|17|P|41723.86|1995-03-25|3-MEDIUM|Clerk#000000682|0|r ideas cajole along the blithely regular gifts.
1596|0|3268|142|F|36024.96|1994-06-25|5-LOW|Clerk#000000746|0|y brave requests unwind furiously accordin
1597|1|4258|92|O|133829.35|1996-10-27|4-NOT SPECIFIED|Clerk#000000364|0|efully final platelets around the blit
1597|0|3878|88|O|59989.66|1997-03-23|1-URGENT|Clerk#000000314|0|e carefully regular platelets. special, express dependencies slee
1598|1|4259|104|O|12918.70|1997-10-09|5-LOW|Clerk#000000781|0|es snooze slyly against the furiously unusual ideas. furious
1598|0|2247|95|F|13491.31|1992-08-02|4-NOT SPECIFIED|Clerk#000000947|0|furiously regular packages. final brai
1599|1|4260|142|F|18566.14|1992-05-16|4-NOT SPECIFIED|Clerk#000000919|0|e among the fluffily bold accounts.
1599|0|1891|61|F|76848.96|1994-12-15|5-LOW|Clerk#000000495|0|unusual foxes sleep regular deposits. requests wake special pac
1600|1|4261|118|F|83665.20|1992-10-03|1-URGENT|Clerk#000000662|0| about the even, pending packages. slyly bold deposits boost
1600|0|2370|142|F|73924.21|1994-01-17|1-URGENT|Clerk#000000231|0|lyly final packages. quickly final deposits haggl
1601|1|4262|88|O|176278.57|1996-08-04|3-MEDIUM|Clerk#000000239|0| of the furious accounts. furiously regular accounts w
1601|0|3558|28|O|112912.00|1996-02-29|1-URGENT|Clerk#000000841|0|around the furiously even requests. quickl
1602|1|4263|4|O|158885.83|1998-03-16|1-URGENT|Clerk#000000265|0|sly ruthless deposits. final packages are instructions. fu
1602|0|3942|76|F|38596.81|1993-06-28|4-NOT SPECIFIED|Clerk#000000608|0|eas cajole bold requests. idly silent instructions 
1603|1|4288|34|F|75030.81|1992-12-04|4-NOT SPECIFIED|Clerk#000000823|0|usly carefully even theodolites: slyly express pac
1603|0|2816|58|F|42225.53|1994-09-20|2-HIGH|Clerk#000000289|0|kages at the final deposits cajole furious foxes. quickly 
1604|1|4289|125|F|20752.62|1993-10-07|3-MEDIUM|Clerk#000000912|0|e carefully close instructions. slyly special reques
1604|0|3365|82|F|174634.12|1994-11-09|2-HIGH|Clerk#000000126|0|he slyly regular foxes nag about the accounts. fluffily 
1605|1|4290|41|F|26128.99|1995-01-15|3-MEDIUM|Clerk#000000688|0| slyly quickly bold requests. final deposits haggle pending ideas! som
1605|0|742|103|F|207632.55|1994-12-23|5-LOW|Clerk#000000543|0|equests? slyly ironic dolphins boost carefully above the blithely
1606|1|4291|89|F|71822.86|1993-11-29|3-MEDIUM|Clerk#000000655|0| sleep fluffily between the bold packages. bold
1606|0|3812|41|O|70502.52|1996-08-13|3-MEDIUM|Clerk#000000727|0|al, final requests cajole
1607|1|4292|25|F|145906.24|1992-01-09|3-MEDIUM|Clerk#000000794|0| ruthlessly. slyly bo
1607|0|3910|64|O|47272.67|1996-08-26|3-MEDIUM|Clerk#000000270|0|ickly. furiously final packag
1608|1|4293|103|O|198322.91|1996-08-20|2-HIGH|Clerk#000000750|0|ly packages. regular packages nag according to t
1608|0|4258|92|O|133829.35|1996-10-27|4-NOT SPECIFIED|Clerk#000000364|0|efully final platelets around the blit
1609|1|4294|49|F|232194.74|1992-08-15|3-MEDIUM|Clerk#000000407|0|ng pinto beans breach. slyly express requests bo
1609|0|3238|61|F|41375.69|1993-02-21|5-LOW|Clerk#000000818|0|lly express deposits are. furiously unusual ideas wake carefully somas. instr
1610|1|4295|5|O|77754.62|1996-02-10|3-MEDIUM|Clerk#000000023|0|e boldly bold dependencies
1610|0|4197|92|O|217709.03|1996-08-13|4-NOT SPECIFIED|Clerk#000000264|0| pinto beans according
1611|1|4320|115|O|67049.37|1996-12-08|4-NOT SPECIFIED|Clerk#000000223|0|ages haggle after the slowly bold se
1611|0|4103|106|F|38164.23|1992-07-03|5-LOW|Clerk#000000679|0|fully ironic dependencies.
1612|1|4321|16|F|118896.95|1994-07-18|3-MEDIUM|Clerk#000000041|0|ending deposits are carefully carefully regular packa
1612|0|3490|91|O|100106.96|1997-05-26|5-LOW|Clerk#000000703|0|gular ideas. furiously silent deposits across the unusual accounts boost i
1613|1|4322|142|O|149671.92|1998-03-13|3-MEDIUM|Clerk#000000433|0|totes nag across the fluffily special instructions. quickly silent hockey 
1613|0|1830|133|F|85122.24|1995-02-23|1-URGENT|Clerk#000000045|0|according to the even,
1614|1|4323|104|F|27598.17|1994-01-23|2-HIGH|Clerk#000000282|0|lve after the slyly regular multipliers. even, regular excus
1614|0|3623|4|O|175017.68|1996-12-26|1-URGENT|Clerk#000000184|0|- ironic excuses boost quickly in place 
1615|1|4324|73|O|178249.05|1995-07-17|1-URGENT|Clerk#000000800|0|ccounts. slyly stealthy requests shall have t
1615|0|3619|149|O|222274.54|1996-11-20|2-HIGH|Clerk#000000211|0|uests mold after the blithely ironic excuses. slyly pending pa
1616|1|4325|130|O|20214.49|1996-07-18|2-HIGH|Clerk#000000591|0|y around the always ev
1616|0|3553|91|F|119838.14|1994-05-18|3-MEDIUM|Clerk#000000270|0|counts mold furiously. slyly i
1617|1|4326|29|O|39048.94|1996-10-27|4-NOT SPECIFIED|Clerk#000000869|0|packages. carefully express deposit
1617|0|3653|40|F|142866.39|1994-03-27|1-URGENT|Clerk#000000402|0| pearls. bold accounts are along the ironic,
1618|1|4327|146|P|126235.35|1995-03-16|2-HIGH|Clerk#000000571|0|yly pending braids. final requests abo
1618|0|4067|16|F|136517.34|1992-10-07|2-HIGH|Clerk#000000027|0|tes boost furiously quick asymptotes. final deposits of the dolphins solv
1619|1|4352|14|O|18653.09|1997-11-26|2-HIGH|Clerk#000000620|0|ly final platelets integrate carefully even requ
1619|0|4324|73|O|178249.05|1995-07-17|1-URGENT|Clerk#000000800|0|ccounts. slyly stealthy requests shall have t
1620|1|4353|73|O|21815.30|1997-12-12|2-HIGH|Clerk#000000790|0|uickly even ideas cajole
1620|0|3013|143|O|156407.40|1997-02-05|5-LOW|Clerk#000000591|0|the furiously pendin
1621|1|4354|145|F|179827.12|1994-09-30|4-NOT SPECIFIED|Clerk#000000046|0|pending notornis. requests serve 
1621|0|2405|73|O|115929.14|1996-12-23|3-MEDIUM|Clerk#000000535|0|ular, regular asympto
1622|1|4355|4|O|186370.23|1996-11-16|1-URGENT|Clerk#000000362|0|ndencies use furiously across the regular 
1622|0|2245|58|F|150585.73|1993-04-28|3-MEDIUM|Clerk#000000528|0|ake carefully. braids haggle slyly quickly b
1623|1|4356|97|F|39828.51|1994-04-11|5-LOW|Clerk#000000956|0| asymptotes sleep blithely. asymptotes sleep. blithely regul
1623|0|1987|100|F|6406.29|1994-04-30|2-HIGH|Clerk#000000652|0|gular platelets alongside 
1624|1|4357|47|O|67045.94|1997-10-23|4-NOT SPECIFIED|Clerk#000000031|0|ages nag between the
1624|0|711|64|F|92484.70|1993-09-23|4-NOT SPECIFIED|Clerk#000000856|0|its. fluffily regular gifts are furi
1625|1|4358|25|O|46298.53|1997-08-12|1-URGENT|Clerk#000000692|0|according to the fluffily special asymptotes 
1625|0|3489|109|F|62453.97|1993-07-29|3-MEDIUM|Clerk#000000307|0|s detect. carefully even platelets across the fur
1626|1|4359|16|F|107824.40|1993-03-03|1-URGENT|Clerk#000000393|0|sts. special, unusual deposits across the ironic theodo
1626|0|2882|121|O|172872.37|1995-08-22|2-HIGH|Clerk#000000891|0|pending deposits. carefully eve
1627|1|4384|25|F|52562.16|1992-07-13|1-URGENT|Clerk#000000192|0|onic platelets. furiously regular asymptotes according to the special pac
1627|0|646|52|F|142070.65|1994-11-22|2-HIGH|Clerk#000000203|0|carefully even foxes. fina
1628|1|4385|122|O|39190.62|1996-08-06|2-HIGH|Clerk#000000597|0|ully final requests. ironic, even dolphins above the regular 
1628|0|4228|110|O|22072.16|1997-03-28|5-LOW|Clerk#000000309|0|pecial requests aft
1629|1|4386|61|O|134413.58|1998-02-06|5-LOW|Clerk#000000070|0| dolphins. silent, idle pinto beans 
1629|0|2722|35|F|50328.84|1994-04-09|5-LOW|Clerk#000000638|0|rding to the carefully quick deposits. bli
1630|1|4387|110|O|116740.67|1995-10-23|1-URGENT|Clerk#000000025|0|ter the regular pinto beans. special, final gifts above the requests wi
1630|0|2369|110|O|73517.91|1996-12-24|2-HIGH|Clerk#000000752|0|iously even requests are dogged, express 
1631|1|4388|10|O|69668.22|1996-03-28|2-HIGH|Clerk#000000715|0|ts wake against the carefully final accounts. sly
1631|0|2724|137|F|116069.66|1994-09-14|2-HIGH|Clerk#000000217|0| sleep blithely. blithely idle 
1632|1|4389|55|F|120324.82|1994-05-05|3-MEDIUM|Clerk#000000403|0|wly express excuses after the permanently even instructions are
1632|0|3271|34|F|86534.05|1992-01-01|1-URGENT|Clerk#000000421|0|s. furiously regular requests
1633|1|4390|7|P|140608.69|1995-05-23|1-URGENT|Clerk#000000691|0|inal pinto beans. exp
1633|0|3815|104|O|14275.01|1997-08-26|1-URGENT|Clerk#000000249|0|es snooze carefully stealth
1634|1|4391|38|F|48284.06|1992-02-18|2-HIGH|Clerk#000000880|0|regular accounts. even depo
1634|0|3589|31|F|39103.37|1994-05-26|2-HIGH|Clerk#000000023|0|ithe deposits nag furiously. furiously pending packages sleep f
1635|1|4416|149|F|76067.10|1992-06-30|5-LOW|Clerk#000000391|0| deposits. ideas cajole express theodolites: 
1635|0|3846|49|O|123120.06|1998-02-05|2-HIGH|Clerk#000000877|0|y alongside of the slyl
1636|1|4417|67|O|60868.39|1998-07-09|1-URGENT|Clerk#000000365|0|ideas are alongside of the blithely final reque
1636|0|3586|121|F|112845.04|1993-12-05|2-HIGH|Clerk#000000438|0|he quickly final courts. carefully regular requests nag unusua
1637|1|4418|61|F|47099.71|1993-03-25|3-MEDIUM|Clerk#000000731|0|pecial pinto beans. close foxes affix iron
1637|0|3426|53|O|91929.93|1996-10-16|3-MEDIUM|Clerk#000000283|0|alongside of the slyly
1638|1|4419|104|O|94030.43|1996-06-12|4-NOT SPECIFIED|Clerk#000000410|0|ages wake furiously slyly thin theodolit
1638|0|3460|82|O|245976.74|1995-10-03|2-HIGH|Clerk#000000078|0|ans integrate carefu
1639|1|4420|109|F|6088.41|1994-06-18|1-URGENT|Clerk#000000706|0|lly bold deposits along the bold, pending foxes detect blithely after the acco
1639|0|3909|22|O|82746.74|1998-07-27|1-URGENT|Clerk#000000980|0|nic, special theodolites sleep furiously! furiously 
1640|1|4421|10|O|258779.02|1997-04-04|3-MEDIUM|Clerk#000000246|0|t the pending warhorses. express waters a
1640|0|3588|119|F|207925.83|1995-03-19|4-NOT SPECIFIED|Clerk#000000316|0|ong the pains. evenly unusual 
1641|1|4422|70|P|107140.22|1995-05-22|3-MEDIUM|Clerk#000000938|0|ly bold accounts sleep special, regular foxes. doggedly regular in
1641|0|2561|58|O|137473.58|1997-11-14|1-URGENT|Clerk#000000861|0|ual requests. unusual deposits cajole furiously pending, regular platelets. 
1642|1|4423|64|F|4913.06|1995-02-17|5-LOW|Clerk#000000888|0|excuses are ruthless
1642|0|4039|29|O|143753.01|1997-11-16|1-URGENT|Clerk#000000358|0|ly ironic deposits. ironic reques
1643|1|4448|70|O|127191.47|1998-05-21|2-HIGH|Clerk#000000428|0|. deposits haggle around the silent packages; slyly unusual packages
1643|0|97|22|F|68908.31|1993-01-29|3-MEDIUM|Clerk#000000547|0|hang blithely along the regular accounts. furiously even ideas after the
1644|1|4449|10|O|48206.14|1998-02-08|5-LOW|Clerk#000000035|0|ourts are carefully even deposits. pending 
1644|0|4100|4|O|3892.77|1996-03-12|3-MEDIUM|Clerk#000000429|0|posits. carefully unusual packages use pending deposits. regular she
1645|1|4450|106|O|110194.31|1997-07-15|1-URGENT|Clerk#000000867|0|quests boost. furiously even realms are blithely bold requests. bl
1645|0|3523|149|O|129657.08|1998-04-07|2-HIGH|Clerk#000000688|0|are on the carefully even depe
1646|1|4451|4|F|92851.80|1994-10-01|1-URGENT|Clerk#000000181|0|. carefully final foxes along the quickly express T
1646|0|4322|142|O|149671.92|1998-03-13|3-MEDIUM|Clerk#000000433|0|totes nag across the fluffily special instructions. quickly silent hockey 
1647|1|4452|13|F|64838.66|1994-06-21|5-LOW|Clerk#000000985|0|oxes are slyly. express, ironic pinto beans wake after the quickly pending re
1647|0|4289|125|F|20752.62|1993-10-07|3-MEDIUM|Clerk#000000912|0|e carefully close instructions. slyly special reques
1648|1|4453|65|O|137030.40|1997-04-01|3-MEDIUM|Clerk#000000603|0|ages could have to nag slyly furiously even asymptotes! slowly regular 
1648|0|4257|17|P|41723.86|1995-03-25|3-MEDIUM|Clerk#000000682|0|r ideas cajole along the blithely regular gifts.
1649|1|4454|142|F|159578.94|1994-02-02|5-LOW|Clerk#000000411|0|uriously regular pint
1649|0|3431|47|F|45536.27|1993-08-22|1-URGENT|Clerk#000000439|0| sleep. slyly busy Tiresias a
1650|1|4455|19|F|102534.63|1993-10-11|3-MEDIUM|Clerk#000000924|0|even requests. bravely regular foxes according to the carefully unusual 
1650|0|1090|19|O|32929.30|1997-11-15|2-HIGH|Clerk#000000300|0| furiously regular platelets haggle along the slyly unusual foxes! 
1651|1|4480|85|F|28658.26|1994-03-31|4-NOT SPECIFIED|Clerk#000000534|0|press, bold deposits boost blit
1651|0|3718|31|O|63195.54|1996-10-23|2-HIGH|Clerk#000000016|0|refully. furiously final packages use carefully slyly pending deposits! final,
1652|1|4481|148|O|77705.40|1996-03-30|5-LOW|Clerk#000000443|0|press sheaves cajole furio
1652|0|4005|140|O|129062.13|1996-11-20|2-HIGH|Clerk#000000341|0|ily according to the slyly iron
1653|1|4482|82|P|63535.56|1995-05-15|4-NOT SPECIFIED|Clerk#000000534|0|ravely bold accounts. furiously ironic instructions affix quickly. pend
1653|0|4033|83|F|57740.74|1993-06-02|5-LOW|Clerk#000000181|0|ously bold instructions haggle furiously above the fluf
1654|1|4483|52|F|126597.21|1992-03-07|3-MEDIUM|Clerk#000000615|0|its. blithely idle accounts run; theodolites wake carefully around the fi
1654|0|4036|47|O|82563.10|1997-04-26|3-MEDIUM|Clerk#000000398|0|ly express deposits nag slyly. ironic, final asymptotes boost bra
1655|1|4484|131|O|237947.61|1996-12-24|1-URGENT|Clerk#000000392|0|ct across the pinto beans. quickly pending excuses engage furiously.
1655|0|4291|89|F|71822.86|1993-11-29|3-MEDIUM|Clerk#000000655|0| sleep fluffily between the bold packages. bold
1656|1|4485|53|F|182432.17|1994-11-13|3-MEDIUM|Clerk#000000038|0|es wake slyly even packages. blithely brave requests nag above the regul
1656|0|3493|82|F|41686.10|1993-08-24|2-HIGH|Clerk#000000887|0|lyly special accounts use blithely across the furiously sil
1657|1|4486|37|O|135613.18|1998-03-03|2-HIGH|Clerk#000000656|0|ffily according to the carefully pending acc
1657|0|3397|130|F|80084.61|1994-06-23|3-MEDIUM|Clerk#000000048|0|yly. final deposits wake f
1658|1|4487|46|F|109469.90|1993-02-23|3-MEDIUM|Clerk#000000017|0|s up the never pending excuses wake furiously special pinto beans. furiously i
1658|0|3527|56|O|145232.09|1997-06-21|5-LOW|Clerk#000000874|0|regular ideas across the quickly bold theodo
1659|1|4512|70|O|148682.82|1995-10-25|5-LOW|Clerk#000000393|0|ending instructions maintain fu
1659|0|3330|7|F|43255.19|1994-12-19|1-URGENT|Clerk#000000124|0|kages use. carefully regular deposits cajole carefully about 
1660|1|4513|85|O|119820.38|1996-03-15|5-LOW|Clerk#000000154|0|ests. final, final ideas
1660|0|4163|64|F|11493.80|1992-12-21|2-HIGH|Clerk#000000268|0| integrate furiously slyly regular depende
1661|1|4514|97|F|143899.85|1994-04-30|3-MEDIUM|Clerk#000000074|0|deposits according to the carefull
1661|0|2563|62|F|168952.10|1993-11-19|4-NOT SPECIFIED|Clerk#000000150|0|sly even packages after the furio
1662|1|4515|140|F|161745.44|1992-03-17|1-URGENT|Clerk#000000191|0|quests among the accounts sleep boldly about the regular f
1662|0|3110|88|F|115161.29|1994-12-17|2-HIGH|Clerk#000000564|0|round the fluffy instructions. carefully silent packages cajol
1663|1|4516|130|F|35949.14|1994-03-29|3-MEDIUM|Clerk#000000739|0|ing packages sleep slyly regular attainments
1663|0|4132|19|P|65601.08|1995-05-29|4-NOT SPECIFIED|Clerk#000000158|0|ld asymptotes solve alongside of the express, final packages. fluffily fi
1664|1|4517|113|O|47614.08|1998-03-07|4-NOT SPECIFIED|Clerk#000000231|0|uriously final deposits doze furiously furiously reg
1664|0|4391|38|F|48284.06|1992-02-18|2-HIGH|Clerk#000000880|0|regular accounts. even depo
1665|1|4518|125|O|25861.74|1997-05-01|3-MEDIUM|Clerk#000000187|0|luffily against the spec
1665|0|3237|19|F|10508.12|1992-06-03|1-URGENT|Clerk#000000606|0|inal requests. slyly even foxes detect about the furiously exp
1666|1|4519|136|F|68885.66|1993-03-30|4-NOT SPECIFIED|Clerk#000000938|0|ccording to the final 
1666|0|1089|49|O|103192.74|1996-05-04|4-NOT SPECIFIED|Clerk#000000226|0|ns haggle ruthlessly. even requests are quickly abov
1667|1|4544|112|O|151148.81|1997-08-07|3-MEDIUM|Clerk#000000435|0|g dependencies dazzle slyly ironic somas. carefu
1667|0|4486|37|O|135613.18|1998-03-03|2-HIGH|Clerk#000000656|0|ffily according to the carefully pending acc
1668|1|4545|59|F|143276.28|1993-01-17|4-NOT SPECIFIED|Clerk#000000303|0|ep. requests use sly
1668|0|3584|13|O|80487.97|1997-08-11|1-URGENT|Clerk#000000760|0|fully bold packages. fluffily final braids haggle final, ironic dolphins. b
1669|1|4546|43|O|39906.87|1995-07-29|5-LOW|Clerk#000000373|0|ns sleep. regular, regular instructions maintai
1669|0|3841|58|F|129033.13|1994-10-05|4-NOT SPECIFIED|Clerk#000000018|0| bold requests sleep quickly ironic packages. sometimes regular deposits nag 
1670|1|4547|109|F|52114.01|1993-08-23|3-MEDIUM|Clerk#000000519|0|uctions thrash platelets. slyly final foxes wake slyly against th
1670|0|3429|146|O|141902.54|1997-01-06|4-NOT SPECIFIED|Clerk#000000737|0|l deposits cajole furiously enticing deposits. blithe packages haggle careful
1671|1|4548|127|O|139915.23|1996-06-28|5-LOW|Clerk#000000798|0| in place of the blithely express sentiments haggle slyly r
1671|0|3042|20|F|104523.03|1994-11-21|3-MEDIUM|Clerk#000000573|0| the slyly ironic depo
1672|1|4549|64|O|43889.17|1998-03-05|4-NOT SPECIFIED|Clerk#000000965|0|ully even deposits dazzle. fluffily pending ideas against the requests
1672|0|3169|19|F|126804.90|1993-12-21|3-MEDIUM|Clerk#000000252|0| even pinto beans are blithely special, special multip
1673|1|4550|118|F|27461.48|1994-12-29|2-HIGH|Clerk#000000748|0|s haggle carefully acco
1673|0|4417|67|O|60868.39|1998-07-09|1-URGENT|Clerk#000000365|0|ideas are alongside of the blithely final reque
1674|1|4551|109|O|82824.14|1996-02-09|2-HIGH|Clerk#000000462|0|ts. slyly quick theodolite
1674|0|2404|77|O|109077.69|1997-03-13|4-NOT SPECIFIED|Clerk#000000409|0|deposits breach furiously. ironic foxes haggle carefully bold packag
1675|1|4576|139|O|56936.10|1996-08-14|5-LOW|Clerk#000000798|0|e pending deposits. 
1675|0|4130|104|O|47823.04|1996-03-10|5-LOW|Clerk#000000609|0|omise alongside of the carefully final foxes. blithel
1676|1|4577|79|O|104259.88|1998-05-02|5-LOW|Clerk#000000409|0|ly. unusual platelets are alw
1676|0|1697|76|O|122621.31|1996-10-07|1-URGENT|Clerk#000000815|0|o x-ray blithely. pl
1677|1|4578|91|F|95761.93|1992-09-13|5-LOW|Clerk#000000121|0| to the furiously ironic instructions? furiou
1677|0|3776|85|F|150349.92|1992-11-20|2-HIGH|Clerk#000000698|0|efully even platelets slee
1678|1|4579|106|O|85927.85|1995-12-01|2-HIGH|Clerk#000000951|0|its wake quickly blithely specia
1678|0|3622|91|O|109202.90|1995-11-27|5-LOW|Clerk#000000012|0|c deposits are fluffily about the blithely final theo
1679|1|4580|82|F|118464.65|1993-11-15|4-NOT SPECIFIED|Clerk#000000086|0|rs wake blithely regular requests. fluffily ev
1679|0|2629|139|O|96458.03|1998-04-06|5-LOW|Clerk#000000680|0|uches dazzle carefully even, express excuses. ac
1680|1|4581|79|F|89592.11|1992-09-04|4-NOT SPECIFIED|Clerk#000000687|0|ges. carefully pending accounts use furiously abo
1680|0|4326|29|O|39048.94|1996-10-27|4-NOT SPECIFIED|Clerk#000000869|0|packages. carefully express deposit
1681|1|4582|19|O|18247.86|1996-07-04|1-URGENT|Clerk#000000638|0|g the furiously regular pac
1681|0|4196|106|O|201455.98|1998-05-15|3-MEDIUM|Clerk#000000532|0|affix carefully. quickly final requests 
1682|1|4583|22|F|206495.43|1994-09-25|3-MEDIUM|Clerk#000000240|0|equests. slyly even platelets was qui
1682|0|1159|70|F|55553.68|1992-09-18|3-MEDIUM|Clerk#000000992|0|ts may sleep. requests according to the
1683|1|4608|80|F|157767.86|1994-06-17|1-URGENT|Clerk#000000259|0|y even instructions detect slyly asymptotes. blithely final packa
1683|0|4389|55|F|120324.82|1994-05-05|3-MEDIUM|Clerk#000000403|0|wly express excuses after the permanently even instructions are
1684|1|4609|133|O|70462.84|1996-12-05|3-MEDIUM|Clerk#000000239|0|hang slyly slyly expre
1684|0|4001|115|O|95929.46|1997-05-15|3-MEDIUM|Clerk#000000878|0|detect. asymptotes sleep furio
1685|1|4610|26|F|135934.60|1993-06-18|5-LOW|Clerk#000000616|0|e carefully express pinto
1685|0|3234|14|O|147343.68|1996-04-05|4-NOT SPECIFIED|Clerk#000000367|0|ents according to the dependencies will sleep after the blithely even p
1686|1|4611|29|F|166506.22|1993-01-10|2-HIGH|Clerk#000000152|0|. furiously regular instructions haggle dolphins. even instructions det
1686|0|3717|28|O|176525.53|1998-06-03|4-NOT SPECIFIED|Clerk#000000974|0|t the carefully even ideas use sp
1687|1|4612|61|F|82598.87|1993-09-20|3-MEDIUM|Clerk#000000397|0|bove the deposits. even deposits dazzle. slyly express packages haggle sl
1687|0|3430|113|F|161066.22|1994-12-12|4-NOT SPECIFIED|Clerk#000000664|0| regular attainments are at the final foxes. final packages along the blithe
1688|1|4613|133|O|212339.55|1998-03-05|3-MEDIUM|Clerk#000000541|0|furiously blithely pending dependen
1688|0|3940|149|O|129012.84|1996-02-14|5-LOW|Clerk#000000363|0|e above the ideas. quickly even dependencies along the blithely ir
1689|1|4614|61|O|151801.06|1996-04-22|1-URGENT|Clerk#000000974|0| sauternes wake thinly special accounts. fur
1689|0|4320|115|O|67049.37|1996-12-08|4-NOT SPECIFIED|Clerk#000000223|0|ages haggle after the slowly bold se
1690|1|4615|29|F|10500.27|1993-08-27|3-MEDIUM|Clerk#000000982|0|jole after the fluffily pending foxes. packages affix carefully acco
1690|0|4484|131|O|237947.61|1996-12-24|1-URGENT|Clerk#000000392|0|ct across the pinto beans. quickly pending excuses engage furiously.
1691|1|4640|97|O|81138.17|1996-01-01|5-LOW|Clerk#000000902|0|requests. deposits do detect above the blithely iron
1691|0|2948|44|F|100758.71|1994-08-23|5-LOW|Clerk#000000701|0| deposits according to the blithely pending 
1692|1|4641|134|F|98485.21|1993-01-20|4-NOT SPECIFIED|Clerk#000000755|0|ronic, final requests integrate slyly: specia
1692|0|3813|146|O|77247.05|1998-06-29|1-URGENT|Clerk#000000531|0|g the furiously regular instructions
1693|1|4642|148|F|117537.87|1995-02-27|1-URGENT|Clerk#000000295|0|cial requests wake carefully around the regular, unusual ideas. furi
1693|0|3681|52|F|36889.65|1992-04-04|1-URGENT|Clerk#000000566|0|. ironic deposits against the ironic, regular frets use pending plat
1694|1|4643|67|O|52414.19|1995-06-30|2-HIGH|Clerk#000000292|0|ously regular packages. unusual, special platel
1694|0|1793|19|F|82504.56|1992-07-12|4-NOT SPECIFIED|Clerk#000000291|0|regular packages cajole. blithely special packages according to the final d
1695|1|4644|94|O|85901.70|1998-01-17|5-LOW|Clerk#000000961|0|requests. fluffily even ideas bo
1695|0|2085|49|F|45311.07|1993-11-21|3-MEDIUM|Clerk#000000818|0|ress, express ideas haggle
1696|1|4645|44|F|231012.22|1994-09-20|1-URGENT|Clerk#000000764|0|fully even instructions. final gifts sublate quickly final requests. bl
1696|0|2886|109|F|94527.23|1994-11-13|4-NOT SPECIFIED|Clerk#000000619|0|uctions. ironic packages sle
1697|1|4646|83|O|124637.19|1996-06-18|1-URGENT|Clerk#000000036|0|n place of the blithely qu
1697|0|4096|139|F|81089.61|1992-07-03|4-NOT SPECIFIED|Clerk#000000706|0|sits. quickly thin deposits x-ray blith
1698|1|4647|28|F|110958.36|1994-05-14|3-MEDIUM|Clerk#000000626|0|out the deposits. slyly final pinto beans haggle idly. slyly s
1698|0|4514|97|F|143899.85|1994-04-30|3-MEDIUM|Clerk#000000074|0|deposits according to the carefull
1699|1|4672|79|O|199593.71|1995-11-07|1-URGENT|Clerk#000000475|0|lyly final dependencies caj
1699|0|3777|28|F|82467.29|1994-04-08|3-MEDIUM|Clerk#000000941|0| regular, special dolphins cajole enticingly ca
1700|1|4673|82|O|58094.75|1996-08-13|4-NOT SPECIFIED|Clerk#000000914|0|c deposits are slyly. bravely ironic deposits cajole carefully after the 
1700|0|4518|125|O|25861.74|1997-05-01|3-MEDIUM|Clerk#000000187|0|luffily against the spec
1701|1|4674|37|F|115411.37|1994-04-19|1-URGENT|Clerk#000000122|0|careful hockey players. carefully pending deposits caj
1701|0|3360|103|O|168750.48|1998-01-23|5-LOW|Clerk#000000254|0| the deposits. fluffily bold requests cajole regula
1702|1|4675|86|F|68817.08|1993-11-25|4-NOT SPECIFIED|Clerk#000000741|0|al deposits haggle slyly final
1702|0|2821|118|F|36592.48|1993-08-09|3-MEDIUM|Clerk#000000323|0|ng requests. even instructions are quickly express, silent instructi
1703|1|4676|14|O|182025.95|1995-09-01|2-HIGH|Clerk#000000407|0|s. slyly bold accounts sleep furiously special
1703|0|3682|32|O|67525.43|1997-01-22|2-HIGH|Clerk#000000001|0|es haggle carefully. decoys nag 
1704|1|4677|40|O|25661.87|1998-02-21|3-MEDIUM|Clerk#000000245|0|ly pending deposits after the carefully regular foxes sleep blithely after t
1704|0|4647|28|F|110958.36|1994-05-14|3-MEDIUM|Clerk#000000626|0|out the deposits. slyly final pinto beans haggle idly. slyly s
1705|1|4678|88|O|131752.07|1998-08-02|4-NOT SPECIFIED|Clerk#000000175|0|side of the bold platelets detect slyly blithely ironic e
1705|0|4165|4|O|11405.40|1997-07-25|3-MEDIUM|Clerk#000000621|0|special foxes affix never blithely ironic pinto beans; blithely 
1706|1|4679|88|F|7211.59|1993-01-20|2-HIGH|Clerk#000000905|0|ely regular accounts affix slyly. final dolphins are. furiously final de
1706|0|3687|43|F|99851.38|1993-02-03|1-URGENT|Clerk#000000585|0|gular accounts. slyly regular instructions can are final ide
1707|1|4704|2|O|63873.14|1996-08-16|4-NOT SPECIFIED|Clerk#000000256|0|lithely final requests about the fluffily regular 
1707|0|3906|46|F|145630.76|1992-05-28|3-MEDIUM|Clerk#000000867|0|ironic theodolites haggle blithely above the final re
1708|1|4705|98|F|173340.09|1992-03-22|4-NOT SPECIFIED|Clerk#000000522|0| special instructions poa
1708|0|4231|86|O|111403.66|1997-11-20|4-NOT SPECIFIED|Clerk#000000630|0|ly final accounts cajole furiously accounts. bravely ironic platelets am
