1367|0|2401|148|O|88448.24|1997-07-29|4-NOT SPECIFIED|Clerk#000000531|0|ully unusual instructions boost carefully silently regular requests. 
1368|1|3333|92|F|197973.22|1992-09-16|4-NOT SPECIFIED|Clerk#000000157|0|ctions boost slyly quickly even accounts. deposits along
1368|0|3265|53|F|43315.15|1992-06-27|1-URGENT|Clerk#000000265|0|re quickly quickly pe
1369|1|3334|76|O|28930.68|1996-02-18|5-LOW|Clerk#000000532|0|ounts maintain carefully. furiously close request
1369|0|3041|113|O|23039.46|1997-06-03|5-LOW|Clerk#000000092|0|s. unusual, pending deposits use carefully. thinly final
1370|1|3335|49|O|112603.34|1995-10-15|3-MEDIUM|Clerk#000000694|0| deposits poach. ironic ideas about the carefully ironi
1370|0|1283|118|O|202623.92|1996-08-30|4-NOT SPECIFIED|Clerk#000000260|0| pinto beans boost slyly ac
1371|1|3360|103|O|168750.48|1998-01-23|5-LOW|Clerk#000000254|0| the deposits. fluffily bold requests cajole regula
1371|0|1281|62|F|165454.51|1994-12-11|1-URGENT|Clerk#000000430|0|counts. carefully pending accounts eat 
1372|1|3361|49|F|75026.51|1992-08-23|4-NOT SPECIFIED|Clerk#000000577|0|unts detect furiously instructions. slow deposi
1372|0|1858|143|O|30457.91|1997-12-13|1-URGENT|Clerk#000000389|0|thely. slyly final deposits sleep
1373|1|3362|140|O|183176.60|1995-07-29|5-LOW|Clerk#000000011|0|the quickly pending deposits. silent, ev
1373|0|3236|142|O|39470.39|1996-11-06|4-NOT SPECIFIED|Clerk#000000553|0|ithely slyly pending req
1374|1|3363|52|O|91017.61|1995-09-23|2-HIGH|Clerk#000000615|0|posits. ironic, final deposits are furiously slyly pending 
1374|0|1409|143|F|72440.52|1992-12-31|4-NOT SPECIFIED|Clerk#000000065|0|ructions. furiously unusual excuses are regular, unusual theodolites. fin
1375|1|3364|46|O|108412.57|1997-06-21|1-URGENT|Clerk#000000280|0|y even foxes? blithely stea
1375|0|2145|134|F|18885.35|1992-10-03|1-URGENT|Clerk#000000886|0|sts would snooze blithely alongside of th
1376|1|3365|82|F|174634.12|1994-11-09|2-HIGH|Clerk#000000126|0|he slyly regular foxes nag about the accounts. fluffily 
1376|0|2112|64|O|17986.15|1997-02-05|2-HIGH|Clerk#000000351|0|against the slyly even id
1377|1|3366|52|O|13603.08|1997-05-18|1-URGENT|Clerk#000000160|0| pinto beans upon the quickly expres
1377|0|1601|53|F|73962.95|1994-08-27|5-LOW|Clerk#000000469|0|ent deposits are ca
1378|1|3367|73|F|101339.68|1992-12-31|4-NOT SPECIFIED|Clerk#000000029|0|efully blithely ironic pinto beans. carefully close 
1378|0|3170|5|O|190142.17|1997-11-09|1-URGENT|Clerk#000000288|0|requests. furiously bold
1379|1|3392|74|O|96057.42|1995-10-28|1-URGENT|Clerk#000000325|0|es thrash blithely depths. bold multipliers wake f
1379|0|3173|148|O|64892.73|1996-08-10|5-LOW|Clerk#000000516|0|ial requests lose along t
1380|1|3393|98|O|183104.71|1995-07-04|2-HIGH|Clerk#000000076|0|even requests. excuses are carefully deposits. fluf
1380|0|2881|100|F|45695.84|1992-05-10|5-LOW|Clerk#000000864|0|uriously. slyly express requests according to the silent dol
1381|1|3394|149|O|162165.94|1996-05-05|4-NOT SPECIFIED|Clerk#000000105|0| blithely among the attainments. carefully final accounts nag blit
1381|0|2277|89|F|79270.23|1995-01-02|4-NOT SPECIFIED|Clerk#000000385|0|accounts cajole. even i
1382|1|3395|149|F|141486.77|1994-10-30|4-NOT SPECIFIED|Clerk#000000682|0|ideas haggle beside the ev
1382|0|3202|88|F|50601.01|1992-12-24|5-LOW|Clerk#000000067|0|fluffily express requests affix carefully around th
1383|1|3396|149|F|196443.16|1994-05-21|3-MEDIUM|Clerk#000000868|0|uffily regular platelet
1383|0|2630|85|F|127132.51|1992-10-24|5-LOW|Clerk#000000712|0|inal theodolites. ironic instructions s
1384|1|3397|130|F|80084.61|1994-06-23|3-MEDIUM|Clerk#000000048|0|yly. final deposits wake f
1384|0|2114|79|F|106446.02|1995-01-16|5-LOW|Clerk#000000751|0|r, unusual accounts haggle across the busy platelets. carefully 
1385|1|3398|67|O|1147.42|1996-09-23|1-URGENT|Clerk#000000818|0|uthless, special courts atop the unusual accounts grow fur
1385|0|2215|40|O|108239.46|1996-06-16|4-NOT SPECIFIED|Clerk#000000817|0|le final, final foxes. quickly regular gifts are carefully deposit
1386|1|3399|122|P|56938.16|1995-02-28|4-NOT SPECIFIED|Clerk#000000575|0|the carefully sly accounts. regular, pending theodolites wa
1386|0|2789|37|O|219123.27|1998-03-14|2-HIGH|Clerk#000000972|0|gular patterns boost. carefully even re
1387|1|3424|103|O|42410.57|1996-08-21|1-URGENT|Clerk#000000190|0|ven requests are quickly pending accounts. blithely furious requests 
1387|0|2852|91|F|99050.81|1993-01-16|1-URGENT|Clerk#000000740|0|ruthless deposits against the final instructions use quickly al
1388|1|3425|115|O|157040.57|1996-03-31|4-NOT SPECIFIED|Clerk#000000188|0|ions. deposits nag blithely alongside of the carefully f
1388|0|352|107|F|16003.86|1994-03-08|2-HIGH|Clerk#000000932|0|ke slyly bold pinto beans. blithely regular accounts against the spe
1389|1|3426|53|O|91929.93|1996-10-16|3-MEDIUM|Clerk#000000283|0|alongside of the slyly
1389|0|868|104|F|127345.45|1992-06-09|4-NOT SPECIFIED|Clerk#000000782|0|onic theodolites print carefully. blithely dogge
1390|1|3427|4|O|133451.14|1997-05-29|4-NOT SPECIFIED|Clerk#000000404|0|y final pinto beans snooze fluffily bold asymptot
1390|0|2817|40|F|71453.85|1994-04-19|3-MEDIUM|Clerk#000000982|0|ic foxes haggle upon the daringly even pinto beans. slyly
1391|1|3428|10|O|88047.04|1996-04-07|5-LOW|Clerk#000000953|0|lar excuses. slyly pending ideas detect p
1391|0|1250|37|F|12907.62|1992-09-29|4-NOT SPECIFIED|Clerk#000000652|0|ts after the fluffily pending instructions use slyly about the s
1392|1|3429|146|O|141902.54|1997-01-06|4-NOT SPECIFIED|Clerk#000000737|0|l deposits cajole furiously enticing deposits. blithe packages haggle careful
1392|0|2947|70|P|43360.95|1995-04-26|1-URGENT|Clerk#000000464|0|ronic accounts. accounts run furiously d
1393|1|3430|113|F|161066.22|1994-12-12|4-NOT SPECIFIED|Clerk#000000664|0| regular attainments are at the final foxes. final packages along the blithe
1393|0|1190|13|O|31043.39|1997-03-16|5-LOW|Clerk#000000575|0|ccounts above the foxes integrate carefully after the 
1394|1|3431|47|F|45536.27|1993-08-22|1-URGENT|Clerk#000000439|0| sleep. slyly busy Tiresias a
1394|0|3300|118|O|27049.22|1995-07-15|5-LOW|Clerk#000000198|0|ses. carefully unusual instructions must have to detect about the blithel
1395|1|3456|46|F|32796.35|1993-06-01|5-LOW|Clerk#000000924|0|es promise slyly. ironicall
1395|0|3074|67|F|85861.93|1992-11-01|5-LOW|Clerk#000000546|0|yly even asymptotes shall have to haggle fluffily. deposits are
1396|1|3457|25|P|174223.20|1995-04-27|4-NOT SPECIFIED|Clerk#000000849|0|ely thin asymptotes. deposits kindle. pending
1396|0|3395|149|F|141486.77|1994-10-30|4-NOT SPECIFIED|Clerk#000000682|0|ideas haggle beside the ev
1397|1|3458|95|F|153069.14|1994-12-22|2-HIGH|Clerk#000000392|0|rges snooze. slyly unusua
1397|0|2562|10|F|136360.37|1992-08-01|1-URGENT|Clerk#000000467|0|elets. pending dolphins promise slyly. bo
1398|1|3459|119|F|127134.05|1994-07-28|4-NOT SPECIFIED|Clerk#000000777|0|n instructions? carefully regular excuses are blithely. silent, ironi
1398|0|2246|113|O|85755.84|1996-05-27|4-NOT SPECIFIED|Clerk#000000739|0| final gifts sleep 
1399|1|3460|82|O|245976.74|1995-10-03|2-HIGH|Clerk#000000078|0|ans integrate carefu
1399|0|2982|85|F|55582.94|1995-03-19|2-HIGH|Clerk#000000402|0|lyly. express theodolites affix slyly after the slyly speci
1400|1|3461|100|F|190960.69|1993-01-31|1-URGENT|Clerk#000000504|0|al, bold deposits cajole fluffily fluffily final foxes. pending ideas beli
1400|0|2818|49|F|120086.84|1994-12-12|3-MEDIUM|Clerk#000000413|0|eep furiously special ideas. express 
1401|1|3462|133|O|63590.17|1997-05-17|3-MEDIUM|Clerk#000000657|0|uriously express asympto
1401|0|2754|145|F|25985.52|1994-04-03|2-HIGH|Clerk#000000960|0|cies detect slyly. 
1402|1|3463|89|F|85255.56|1993-08-18|1-URGENT|Clerk#000000545|0|ding to the carefully ironic deposits
1402|0|960|35|F|63537.13|1994-09-21|3-MEDIUM|Clerk#000000120|0|regular accounts. requests
1403|1|3488|148|F|92716.17|1995-01-08|3-MEDIUM|Clerk#000000694|0|cording to the carefully regular deposits. re
1403|0|801|118|F|127717.72|1992-02-18|1-URGENT|Clerk#000000186|0|iously from the furiously enticing reques
1404|1|3489|109|F|62453.97|1993-07-29|3-MEDIUM|Clerk#000000307|0|s detect. carefully even platelets across the fur
1404|0|3458|95|F|153069.14|1994-12-22|2-HIGH|Clerk#000000392|0|rges snooze. slyly unusua
1405|1|3490|91|O|100106.96|1997-05-26|5-LOW|Clerk#000000703|0|gular ideas. furiously silent deposits across the unusual accounts boost i
1405|0|3488|148|F|92716.17|1995-01-08|3-MEDIUM|Clerk#000000694|0|cording to the carefully regular deposits. re
1406|1|3491|83|O|50287.06|1998-06-24|1-URGENT|Clerk#000000560|0|nic orbits believe carefully across the 
1406|0|2531|44|O|143212.85|1996-05-06|4-NOT SPECIFIED|Clerk#000000095|0|even accounts. furiously ironic excuses sleep fluffily. carefully silen
1407|1|3492|103|F|168721.45|1994-11-24|5-LOW|Clerk#000000066|0|packages along the regular foxes lose final dependencie
1407|0|1952|67|F|12896.25|1994-03-16|2-HIGH|Clerk#000000254|0| silent accounts boost 
1408|1|3493|82|F|41686.10|1993-08-24|2-HIGH|Clerk#000000887|0|lyly special accounts use blithely across the furiously sil
1408|0|997|109|O|27561.82|1997-05-19|2-HIGH|Clerk#000000651|0|ly express depths. furiously final requests haggle furiously. carefu
1409|1|3494|49|F|136058.70|1993-04-04|5-LOW|Clerk#000000559|0|r instructions haggle. accounts cajole. carefully final requests at the 
1409|0|3172|89|F|121360.83|1992-06-03|4-NOT SPECIFIED|Clerk#000000771|0|es. slyly ironic packages x-ra
1410|1|3495|31|O|58666.79|1996-02-26|2-HIGH|Clerk#000000441|0|nticing excuses are carefully
1410|0|2914|109|F|60867.14|1993-03-03|3-MEDIUM|Clerk#000000543|0|he slyly regular theodolites are furiously sile
1411|1|3520|125|O|151233.65|1997-08-04|1-URGENT|Clerk#000000023|0|hely. ideas nag; even, even fo
1411|0|615|67|F|32890.89|1992-05-09|5-LOW|Clerk#000000388|0|t to promise asymptotes. packages haggle alongside of the fluffil
1412|1|3521|7|F|142029.67|1992-10-26|5-LOW|Clerk#000000812|0|y even instructions cajole carefully above the bli
1412|0|3266|4|P|68309.28|1995-03-17|5-LOW|Clerk#000000545|0|refully ironic instructions. slyly final pi
1413|1|3522|26|F|151515.08|1994-09-26|5-LOW|Clerk#000000250|0|deposits-- slyly stealthy requests boost caref
1413|0|3428|10|O|88047.04|1996-04-07|5-LOW|Clerk#000000953|0|lar excuses. slyly pending ideas detect p
1414|1|3523|149|O|129657.08|1998-04-07|2-HIGH|Clerk#000000688|0|are on the carefully even depe
1414|0|3015|103|F|110826.83|1992-09-27|5-LOW|Clerk#000000013|0|ously regular deposits affix carefully. furiousl
1415|1|3524|94|F|22767.49|1992-05-03|2-HIGH|Clerk#000000607|0|efully unusual tithes among the foxes use blithely daringly bold deposits. re
1415|0|3078|49|F|46310.83|1993-02-12|2-HIGH|Clerk#000000110|0|ounts are alongside of the blith
1416|1|3525|109|O|100749.60|1995-12-22|4-NOT SPECIFIED|Clerk#000000084|0|s nag among the blithely e
1416|0|198|112|O|125792.83|1998-01-02|4-NOT SPECIFIED|Clerk#000000331|0|its. carefully ironic requests sleep. furiously express fox
1417|1|3526|56|F|53827.34|1995-03-16|5-LOW|Clerk#000000364|0|to the quickly special deposits print agai
1417|0|647|143|O|56449.23|1997-08-07|1-URGENT|Clerk#000000270|0|egular pearls. carefully express asymptotes are. even account
1418|1|3527|56|O|145232.09|1997-06-21|5-LOW|Clerk#000000874|0|regular ideas across the quickly bold theodo
1418|0|3459|119|F|127134.05|1994-07-28|4-NOT SPECIFIED|Clerk#000000777|0|n instructions? carefully regular excuses are blithely. silent, ironi
1419|1|3552|35|O|103656.44|1997-04-23|2-HIGH|Clerk#000000973|0| the ironic packages. furiously 
1419|0|1959|43|O|62277.18|1997-01-13|4-NOT SPECIFIED|Clerk#000000631|0| cajole about the blithely express requests. even excuses mold bl
1420|1|3553|91|F|119838.14|1994-05-18|3-MEDIUM|Clerk#000000270|0|counts mold furiously. slyly i
1420|0|1314|143|F|56207.66|1994-05-13|3-MEDIUM|Clerk#000000485|0|ickly blithe packages nod ideas. furiously bold braids boost around the car
1421|1|3554|44|O|98335.61|1995-06-17|5-LOW|Clerk#000000931|0|hely ironic requests haggl
1421|0|2657|25|O|148176.06|1995-10-17|2-HIGH|Clerk#000000160|0| foxes-- slyly final dependencies around the slyly final theodo
1422|1|3555|46|O|134442.37|1996-07-07|5-LOW|Clerk#000000585|0|s nag carefully regular, even pinto be
1422|0|1764|29|F|47384.71|1992-03-25|1-URGENT|Clerk#000000182|0|. slyly final packages integrate carefully acro
1423|1|3556|16|F|114681.55|1992-09-23|4-NOT SPECIFIED|Clerk#000000140|0|e. dependencies need to haggle alongs
1423|0|1669|2|O|24362.39|1997-06-09|3-MEDIUM|Clerk#000000663|0|er ironic requests detect furiously blithely sp
1424|1|3557|121|F|85477.89|1992-11-09|2-HIGH|Clerk#000000291|0|ithely courts. furi
1424|0|3014|29|F|194159.59|1992-10-30|4-NOT SPECIFIED|Clerk#000000476|0|ep blithely according to the blith
1425|1|3558|28|O|112912.00|1996-02-29|1-URGENT|Clerk#000000841|0|around the furiously even requests. quickl
1425|0|1126|145|O|59982.31|1998-01-28|4-NOT SPECIFIED|Clerk#000000928|0|d slyly regular ideas: special ideas believe slyly. slyly ironic sheaves w
1426|1|3559|106|F|30722.49|1992-10-24|3-MEDIUM|Clerk#000000634|0|sly deposits. fluffily final ideas cajole careful
1426|0|3108|85|F|63278.00|1993-08-05|1-URGENT|Clerk#000000574|0|s packages haggle furiously am
1427|1|3584|13|O|80487.97|1997-08-11|1-URGENT|Clerk#000000760|0|fully bold packages. fluffily final braids haggle final, ironic dolphins. b
1427|0|3552|35|O|103656.44|1997-04-23|2-HIGH|Clerk#000000973|0| the ironic packages. furiously 
1428|1|3585|139|F|159015.39|1994-11-23|2-HIGH|Clerk#000000988|0|regular asymptotes. bold pains above the carefully pending asymptot
1428|0|3044|53|O|52433.54|1996-04-03|2-HIGH|Clerk#000000008|0|cajole final courts. ironic deposits about the quickly final re
1429|1|3586|121|F|112845.04|1993-12-05|2-HIGH|Clerk#000000438|0|he quickly final courts. carefully regular requests nag unusua
1429|0|3301|133|F|48497.09|1994-09-04|4-NOT SPECIFIED|Clerk#000000325|0|ular gifts impress enticingly carefully express deposits; instructions boo
1430|1|3587|79|O|174798.97|1996-05-10|4-NOT SPECIFIED|Clerk#000000443|0|ular patterns detect 
1430|0|3393|98|O|183104.71|1995-07-04|2-HIGH|Clerk#000000076|0|even requests. excuses are carefully deposits. fluf
1431|1|3588|119|F|207925.83|1995-03-19|4-NOT SPECIFIED|Clerk#000000316|0|ong the pains. evenly unusual 
1431|0|3333|92|F|197973.22|1992-09-16|4-NOT SPECIFIED|Clerk#000000157|0|ctions boost slyly quickly even accounts. deposits along
1432|1|3589|31|F|39103.37|1994-05-26|2-HIGH|Clerk#000000023|0|ithe deposits nag furiously. furiously pending packages sleep f
1432|0|1127|58|O|103320.91|1995-09-19|4-NOT SPECIFIED|Clerk#000000397|0|usly silent, regular pinto beans. blithely express requests boos
1433|1|3590|149|P|218482.70|1995-05-13|5-LOW|Clerk#000000986|0|lyly final deposits.
1433|0|2210|32|F|31689.46|1992-01-16|2-HIGH|Clerk#000000941|0| believe carefully quickly express pinto beans. deposi
1434|1|3591|136|F|98140.86|1993-12-08|3-MEDIUM|Clerk#000000144|0|ual foxes haggle! unusual request
1434|0|3303|145|O|97758.28|1997-12-14|4-NOT SPECIFIED|Clerk#000000661|0|nto beans sleep furiously above the carefully ironic 
1435|1|3616|128|F|60933.29|1994-02-16|4-NOT SPECIFIED|Clerk#000000268|0|uickly about the quickly final requests. fluffily final packages wake evenly
1435|0|2695|58|O|138584.20|1996-08-20|1-URGENT|Clerk#000000697|0|ven deposits around the quickly regular packa
1436|1|3617|40|O|126205.42|1996-03-19|3-MEDIUM|Clerk#000000886|0|the carefully regular platelets ha
1436|0|1541|94|P|47286.32|1995-05-18|1-URGENT|Clerk#000000906|0|y. slyly ironic warhorses around the furiously regul
1437|1|3618|10|O|136954.81|1997-12-13|3-MEDIUM|Clerk#000000894|0|. ideas run carefully. thin, pending 
1437|0|2016|8|O|24347.36|1996-08-16|3-MEDIUM|Clerk#000000641|0|the carefully ironic foxes. requests nag bold, r
1438|1|3619|149|O|222274.54|1996-11-20|2-HIGH|Clerk#000000211|0|uests mold after the blithely ironic excuses. slyly pending pa
1438|0|578|94|O|70392.02|1997-01-10|5-LOW|Clerk#000000281|0|e blithely even packages. slyly pending platelets bes
1439|1|3620|44|O|59291.75|1997-03-07|5-LOW|Clerk#000000124|0|le quickly against the epitaphs. requests sleep slyly according to the
1439|0|2340|65|O|30778.78|1996-01-12|1-URGENT|Clerk#000000964|0|ter the deposits sleep according to the slyly regular packages. carefully 
1440|1|3621|142|F|106150.05|1993-05-06|3-MEDIUM|Clerk#000000643|0|kly unusual deposits. qu
1440|0|2820|19|F|143813.39|1994-05-20|3-MEDIUM|Clerk#000000807|0|equests are furiously. carefu
1441|1|3622|91|O|109202.90|1995-11-27|5-LOW|Clerk#000000012|0|c deposits are fluffily about the blithely final theo
1441|0|3203|127|O|49357.72|1997-11-05|2-HIGH|Clerk#000000493|0|e furiously silent warhorses. slyly silent deposits wake bli
1442|1|3623|4|O|175017.68|1996-12-26|1-URGENT|Clerk#000000184|0|- ironic excuses boost quickly in place 
1442|0|2144|136|F|119917.28|1994-03-29|3-MEDIUM|Clerk#000000546|0|t. carefully quick requests across the deposits wake regu
1443|1|3648|125|F|180417.11|1993-06-17|5-LOW|Clerk#000000717|0|foxes. unusual deposits boost quickly. slyly regular asymptotes across t
1443|0|1254|70|O|94649.25|1995-12-22|1-URGENT|Clerk#000000607|0| pinto beans. carefully regular request
1444|1|3649|40|F|124470.32|1994-07-06|5-LOW|Clerk#000000349|0|taphs boost above the final p
1444|0|3367|73|F|101339.68|1992-12-31|4-NOT SPECIFIED|Clerk#000000029|0|efully blithely ironic pinto beans. carefully close 
1445|1|3650|46|F|189547.57|1992-05-28|4-NOT SPECIFIED|Clerk#000000454|0|kages sleep fluffily slyly
1445|0|3491|83|O|50287.06|1998-06-24|1-URGENT|Clerk#000000560|0|nic orbits believe carefully across the 
1446|1|3651|100|O|113191.45|1998-04-27|1-URGENT|Clerk#000000222|0|ly unusual deposits thrash quickly after the ideas.
1446|0|3425|115|O|157040.57|1996-03-31|4-NOT SPECIFIED|Clerk#000000188|0|ions. deposits nag blithely alongside of the carefully f
1447|1|3652|107|O|107732.23|1997-02-25|4-NOT SPECIFIED|Clerk#000000024|0|sly even requests after the 
1447|0|1666|95|O|128367.97|1995-10-18|1-URGENT|Clerk#000000849|0|ffily pending dependencies wake fluffily. pending, final accounts 
1448|1|3653|40|F|142866.39|1994-03-27|1-URGENT|Clerk#000000402|0| pearls. bold accounts are along the ironic,
1448|0|3233|140|F|54121.92|1994-10-24|5-LOW|Clerk#000000470|0|ly ironic epitaphs use stealthy, express deposits. quickly regular instruct
1449|1|3654|7|F|222653.54|1992-06-03|5-LOW|Clerk#000000475|0|s cajole slyly carefully special theodolites. even deposits haggl
1449|0|582|50|O|129004.81|1997-10-21|1-URGENT|Clerk#000000378|0|n pinto beans print a
1450|1|3655|49|F|74882.22|1992-10-06|1-URGENT|Clerk#000000815|0|er the carefully unusual deposits sleep quickly according to
1450|0|583|49|O|127817.38|1997-03-19|3-MEDIUM|Clerk#000000792|0|efully express requests. a
1451|1|3680|127|F|124402.59|1992-12-10|4-NOT SPECIFIED|Clerk#000000793|0|ular platelets. carefully regular packages cajole blithely al
1451|0|2944|14|O|146581.14|1997-09-24|4-NOT SPECIFIED|Clerk#000000740|0|deas. permanently special foxes haggle carefully ab
1452|1|3681|52|F|36889.65|1992-04-04|1-URGENT|Clerk#000000566|0|. ironic deposits against the ironic, regular frets use pending plat
1452|0|3079|100|O|148299.05|1997-09-12|5-LOW|Clerk#000000505|0|lly ironic accounts
1453|1|3682|32|O|67525.43|1997-01-22|2-HIGH|Clerk#000000001|0|es haggle carefully. decoys nag 
1453|0|359|79|F|142891.22|1994-12-19|3-MEDIUM|Clerk#000000934|0|n dolphins. special courts above the carefully ironic requests use
1454|1|3683|88|F|99960.46|1993-03-04|2-HIGH|Clerk#000000248|0|ze across the express foxes. carefully special acco
1454|0|486|52|O|185968.15|1996-03-11|4-NOT SPECIFIED|Clerk#000000803|0|riously dolphins. fluffily ironic requ
1455|1|3684|23|F|89509.91|1993-07-20|2-HIGH|Clerk#000000835|0|bold accounts affix along the carefully ironic requ
1455|0|3264|94|O|162634.53|1996-11-02|5-LOW|Clerk#000000244|0|carefully. express, bold
1456|1|3685|16|F|154958.89|1992-01-17|3-MEDIUM|Clerk#000000954|0| sleep fluffily special ide
1456|0|3461|100|F|190960.69|1993-01-31|1-URGENT|Clerk#000000504|0|al, bold deposits cajole fluffily fluffily final foxes. pending ideas beli
1457|1|3686|40|O|82190.77|1998-07-07|2-HIGH|Clerk#000000175|0|s. furiously final pinto beans poach carefully among 
1457|0|3109|124|F|216104.85|1993-07-24|5-LOW|Clerk#000000936|0|bold requests sleep quickly according to the slyly final
1458|1|3687|43|F|99851.38|1993-02-03|1-URGENT|Clerk#000000585|0|gular accounts. slyly regular instructions can are final ide
1458|0|3073|136|F|151419.50|1994-01-08|3-MEDIUM|Clerk#000000404|0|kly slyly bold accounts. express courts near the regular ideas sleep bli
1459|1|3712|64|F|127527.05|1992-01-02|2-HIGH|Clerk#000000032|0| promise according 
1459|0|2146|118|F|179686.07|1992-09-14|4-NOT SPECIFIED|Clerk#000000476|0|ven packages. dependencies wake slyl
1460|1|3713|149|O|215342.63|1998-05-07|3-MEDIUM|Clerk#000000325|0|s haggle quickly. ironic, regular Tiresi
1460|0|803|16|O|27629.66|1997-04-29|5-LOW|Clerk#000000260|0|ic instructions. even deposits haggle furiously at the deposits-- regular de
1461|1|3714|40|O|84493.55|1998-05-01|3-MEDIUM|Clerk#000000595|0|nding accounts. ironic pinto beans wake slyly. furiously pendin
1461|0|3235|46|O|104695.09|1995-11-15|5-LOW|Clerk#000000349|0| quickly pinto beans. ironi
1462|1|3715|65|O|64000.93|1996-03-18|1-URGENT|Clerk#000000463|0| always silent requests wake pinto beans. slyly pending foxes are aga
1462|0|2564|77|F|3967.47|1994-09-09|2-HIGH|Clerk#000000718|0|usly regular pinto beans. orbits wake carefully. slyly e
1463|1|3716|43|O|146221.66|1997-08-19|4-NOT SPECIFIED|Clerk#000000748|0| pending ideas haggle. ironic,
1463|0|3142|8|F|16030.15|1992-06-28|3-MEDIUM|Clerk#000000043|0|usual accounts about the carefully special requests sleep slyly quickly regul
1464|1|3717|28|O|176525.53|1998-06-03|4-NOT SPECIFIED|Clerk#000000974|0|t the carefully even ideas use sp
1464|0|3457|25|P|174223.20|1995-04-27|4-NOT SPECIFIED|Clerk#000000849|0|ely thin asymptotes. deposits kindle. pending
1465|1|3718|31|O|63195.54|1996-10-23|2-HIGH|Clerk#000000016|0|refully. furiously final packages use carefully slyly pending deposits! final,
1465|0|3398|67|O|1147.42|1996-09-23|1-URGENT|Clerk#000000818|0|uthless, special courts atop the unusual accounts grow fur
1466|1|3719|118|O|139902.71|1997-02-16|2-HIGH|Clerk#000000034|0|, enticing accounts are blithely among the daringly final asymptotes. furious
1466|0|1824|49|F|81351.53|1994-05-05|1-URGENT|Clerk#000000972|0|e blithely fluffily
1467|1|3744|65|F|33085.68|1992-01-10|3-MEDIUM|Clerk#000000765|0|osits sublate about the regular requests. fluffily unusual accou
1467|0|3424|103|O|42410.57|1996-08-21|1-URGENT|Clerk#000000190|0|ven requests are quickly pending accounts. blithely furious requests 
1468|1|3745|112|F|19405.73|1993-09-29|5-LOW|Clerk#000000181|0|ckages poach slyly against the foxes. slyly ironic instructi
1468|0|3105|137|O|125396.80|1996-11-13|4-NOT SPECIFIED|Clerk#000000772|0|s. blithely final ins
1469|1|3746|74|F|80018.54|1994-09-11|4-NOT SPECIFIED|Clerk#000000188|0|. express, special requests nag quic
1469|0|325|41|F|71543.41|1993-10-17|5-LOW|Clerk#000000844|0|ly sometimes pending pa
1470|1|3747|149|O|204355.65|1996-08-20|1-URGENT|Clerk#000000226|0|refully across the final theodolites. carefully bold accounts cajol
1470|0|3297|139|F|9679.45|1992-11-03|2-HIGH|Clerk#000000220|0| after the theodolites cajole carefully according to the finally
1471|1|3748|53|O|83804.38|1998-02-28|1-URGENT|Clerk#000000156|0|slyly special packages
1471|0|2980|4|O|187514.11|1996-09-14|3-MEDIUM|Clerk#000000661|0|y quick pinto beans wake. slyly re
1472|1|3749|38|P|87073.89|1995-02-24|3-MEDIUM|Clerk#000000639|0|y regular instructions haggle blithel
1472|0|2115|106|O|134814.65|1998-05-23|4-NOT SPECIFIED|Clerk#000000101|0|odolites boost. carefully regular excuses cajole. quickly ironic pinto be
1473|1|3750|97|P|177181.67|1995-04-30|3-MEDIUM|Clerk#000000885|0|y. express, even packages wake after the ide
1473|0|3136|23|F|145426.11|1994-08-10|4-NOT SPECIFIED|Clerk#000000891|0|tructions sleep slyly. pending di
1474|1|3751|10|F|202917.72|1994-04-27|4-NOT SPECIFIED|Clerk#000000925|0|sheaves. express, unusual t
1474|0|3555|46|O|134442.37|1996-07-07|5-LOW|Clerk#000000585|0|s nag carefully regular, even pinto be
1475|1|3776|85|F|150349.92|1992-11-20|2-HIGH|Clerk#000000698|0|efully even platelets slee
1475|0|1316|16|F|163746.47|1993-12-03|1-URGENT|Clerk#000000857|0|ully bold theodolites? pending, bold pin
1476|1|3777|28|F|82467.29|1994-04-08|3-MEDIUM|Clerk#000000941|0| regular, special dolphins cajole enticingly ca
1476|0|1538|29|O|179554.41|1995-06-18|4-NOT SPECIFIED|Clerk#000000258|0| instructions. regular theod
1477|1|3778|106|F|221036.31|1993-05-26|1-URGENT|Clerk#000000187|0| above the express requests. packages maintain fluffily according to
1477|0|3200|13|O|131103.31|1996-02-07|1-URGENT|Clerk#000000020|0| regular dependencies impress evenly even excuses. blithely 
1478|1|3779|74|O|31538.94|1997-01-05|4-NOT SPECIFIED|Clerk#000000670|0| against the deposits. quickly bold instructions x-ray. pending fox
1478|0|2752|59|F|187932.30|1993-11-19|2-HIGH|Clerk#000000648|0| carefully regular foxes are quickly quickl
1479|1|3780|41|O|65385.42|1996-04-13|5-LOW|Clerk#000000967|0| around the brave, pendin
1479|0|1378|20|O|118495.12|1996-03-09|4-NOT SPECIFIED|Clerk#000000705|0| furiously even tithes cajole slyly among the quick
1480|1|3781|139|O|133864.82|1996-06-20|1-URGENT|Clerk#000000394|0|yly after the ruthless packages. pinto beans use slyly: never ironic dependenc
1480|0|2535|121|F|67018.30|1993-05-25|5-LOW|Clerk#000000296|0|phins cajole beneath the fluffily express asymptotes. c
1481|1|3782|65|O|145096.17|1996-08-24|1-URGENT|Clerk#000000121|0|counts are. pending, regular asym
