206|1|1|37|O|131251.81|1996-01-02|5-LOW|Clerk#000000951|0|nstructions sleep furiously among 
207|1|2|79|O|40183.29|1996-12-01|1-URGENT|Clerk#000000880|0| foxes. pending accounts at the pending, silent asymptot
208|1|3|124|F|160882.76|1993-10-14|5-LOW|Clerk#000000955|0|sly final accounts boost. carefully regular ideas cajole carefully. depos
209|1|4|137|O|31084.79|1995-10-11|5-LOW|Clerk#000000124|0|sits. slyly regular warthogs cajole. regular, regular theodolites acro
210|1|5|46|F|86615.25|1994-07-30|5-LOW|Clerk#000000925|0|quickly. bold deposits sleep slyly. packages use slyly
211|1|6|56|F|36468.55|1992-02-21|4-NOT SPECIFIED|Clerk#000000058|0|ggle. special, final requests are against the furiously specia
212|1|7|40|O|171488.73|1996-01-10|2-HIGH|Clerk#000000470|0|ly special requests 
213|1|32|131|O|116923.00|1995-07-16|2-HIGH|Clerk#000000616|0|ise blithely bold, regular requests. quickly unusual dep
214|1|33|67|F|99798.76|1993-10-27|3-MEDIUM|Clerk#000000409|0|uriously. furiously final request
215|1|34|62|O|41670.02|1998-07-21|3-MEDIUM|Clerk#000000223|0|ly final packages. fluffily final deposits wake blithely ideas. spe
216|1|35|128|O|148789.52|1995-10-23|4-NOT SPECIFIED|Clerk#000000259|0|zzle. carefully enticing deposits nag furio
217|1|36|116|O|38988.98|1995-11-03|1-URGENT|Clerk#000000358|0| quick packages are blithely. slyly silent accounts wake qu
218|1|37|88|F|113701.89|1992-06-03|3-MEDIUM|Clerk#000000456|0|kly regular pinto beans. carefully unusual waters cajole never
219|1|38|125|O|46366.56|1996-08-21|4-NOT SPECIFIED|Clerk#000000604|0|haggle blithely. furiously express ideas haggle blithely furiously regular re
220|1|39|82|O|219707.84|1996-09-20|3-MEDIUM|Clerk#000000659|0|ole express, ironic requests: ir
221|1|64|34|F|20065.73|1994-07-16|3-MEDIUM|Clerk#000000661|0|wake fluffily. sometimes ironic pinto beans about the dolphin
222|1|65|17|P|65883.92|1995-03-18|1-URGENT|Clerk#000000632|0|ular requests are blithely pending orbits-- even requests against the deposit
223|1|66|130|F|79258.24|1994-01-20|5-LOW|Clerk#000000743|0|y pending requests integrate
224|1|67|58|O|116227.05|1996-12-19|4-NOT SPECIFIED|Clerk#000000547|0|symptotes haggle slyly around the furiously iron
225|1|68|29|O|215135.72|1998-04-18|3-MEDIUM|Clerk#000000440|0| pinto beans sleep carefully. blithely ironic deposits haggle furiously acro
226|1|69|85|F|162176.23|1994-06-04|4-NOT SPECIFIED|Clerk#000000330|0| depths atop the slyly thin deposits detect among the furiously silent accou
227|1|70|65|F|84651.80|1993-12-18|5-LOW|Clerk#000000322|0| carefully ironic request
228|1|71|4|O|178821.73|1998-01-24|4-NOT SPECIFIED|Clerk#000000271|0| express deposits along the blithely regul
229|1|96|109|F|55090.67|1994-04-17|2-HIGH|Clerk#000000395|0|oost furiously. pinto
230|1|97|22|F|68908.31|1993-01-29|3-MEDIUM|Clerk#000000547|0|hang blithely along the regular accounts. furiously even ideas after the
231|1|98|106|F|51004.44|1994-09-25|1-URGENT|Clerk#000000448|0|c asymptotes. quickly regular packages should have to nag re
232|1|99|89|F|92326.79|1994-03-13|4-NOT SPECIFIED|Clerk#000000973|0|e carefully ironic packages. pending
233|1|100|148|O|141311.01|1998-02-28|4-NOT SPECIFIED|Clerk#000000577|0|heodolites detect slyly alongside of the ent
234|1|101|28|O|95591.40|1996-03-17|3-MEDIUM|Clerk#000000419|0|ding accounts above the slyly final asymptote
235|1|102|1|O|113954.89|1997-05-09|2-HIGH|Clerk#000000596|0| slyly according to the asymptotes. carefully final packages integrate furious
236|1|103|31|O|95563.95|1996-06-20|4-NOT SPECIFIED|Clerk#000000090|0|ges. carefully unusual instructions haggle quickly regular f
237|1|128|74|F|36333.34|1992-06-15|1-URGENT|Clerk#000000385|0|ns integrate fluffily. ironic asymptotes after the regular excuses nag around 
238|1|129|73|F|188124.55|1992-11-19|5-LOW|Clerk#000000859|0|ing tithes. carefully pending deposits boost about the silently express 
239|1|130|37|F|115717.37|1992-05-08|2-HIGH|Clerk#000000036|0|le slyly unusual, regular packages? express deposits det
240|1|131|94|F|96596.81|1994-06-08|3-MEDIUM|Clerk#000000625|0|after the fluffily special foxes integrate s
241|1|132|28|F|118802.62|1993-06-11|3-MEDIUM|Clerk#000000488|0|sits are daringly accounts. carefully regular foxes sleep slyly about the
242|1|133|44|O|80437.72|1997-11-29|1-URGENT|Clerk#000000738|0|usly final asymptotes 
243|1|134|7|F|154260.84|1992-05-01|4-NOT SPECIFIED|Clerk#000000711|0|lar theodolites boos
244|1|135|61|O|174569.88|1995-10-21|4-NOT SPECIFIED|Clerk#000000804|0|l platelets use according t
245|1|160|83|O|86076.86|1996-12-19|4-NOT SPECIFIED|Clerk#000000342|0|thely special sauternes wake slyly of t
246|1|161|17|F|19056.99|1994-08-31|2-HIGH|Clerk#000000322|0|carefully! special instructions sin
247|1|162|16|O|2158.13|1995-05-08|3-MEDIUM|Clerk#000000378|0|nts hinder fluffily ironic instructions. express, express excuses 
248|1|163|88|O|125170.86|1997-09-05|3-MEDIUM|Clerk#000000379|0|y final packages. final foxes since the quickly even
249|1|164|1|F|202660.52|1992-10-21|5-LOW|Clerk#000000209|0|cajole ironic courts. slyly final ideas are slyly. blithely final Tiresias sub
250|1|165|28|F|141824.23|1993-01-30|4-NOT SPECIFIED|Clerk#000000292|0|across the blithely regular accounts. bold
251|1|166|109|O|93335.60|1995-09-12|2-HIGH|Clerk#000000440|0|lets. ironic, bold asymptotes kindle
252|1|167|121|F|52982.23|1993-01-04|4-NOT SPECIFIED|Clerk#000000731|0|s nag furiously bold excuses. fluffily iron
253|1|192|83|O|133002.55|1997-11-25|5-LOW|Clerk#000000483|0|y unusual platelets among the final instructions integrate rut
254|1|193|80|F|48053.18|1993-08-08|1-URGENT|Clerk#000000025|0|the furiously final pin
255|1|194|62|F|114097.63|1992-04-05|3-MEDIUM|Clerk#000000352|0|egular requests haggle slyly regular, regular pinto beans. asymptote
256|1|195|136|F|120053.52|1993-12-28|3-MEDIUM|Clerk#000000216|0|old forges are furiously sheaves. slyly fi
312|1|196|65|F|33248.04|1993-03-17|2-HIGH|Clerk#000000988|0|beans boost at the foxes. silent foxes
313|1|197|34|P|100290.07|1995-04-07|2-HIGH|Clerk#000000969|0|solve quickly about the even braids. carefully express deposits affix care
314|1|198|112|O|125792.83|1998-01-02|4-NOT SPECIFIED|Clerk#000000331|0|its. carefully ironic requests sleep. furiously express fox
315|1|199|53|O|80592.44|1996-03-07|2-HIGH|Clerk#000000489|0|g theodolites. special packag
316|1|224|4|F|155680.60|1994-06-18|4-NOT SPECIFIED|Clerk#000000642|0|r the quickly thin courts. carefully
317|1|225|34|P|165890.47|1995-05-25|1-URGENT|Clerk#000000177|0|s. blithely ironic accounts wake quickly fluffily special acc
318|1|226|128|F|180119.22|1993-03-10|2-HIGH|Clerk#000000756|0|s are carefully at the blithely ironic acc
319|1|227|10|O|46076.46|1995-11-10|5-LOW|Clerk#000000919|0| express instructions. slyly regul
320|1|228|46|F|2638.98|1993-02-25|1-URGENT|Clerk#000000562|0|es was slyly among the regular foxes. blithely regular dependenci
321|1|229|112|F|142290.77|1993-12-29|1-URGENT|Clerk#000000628|0|he fluffily even instructions. furiously i
322|1|230|103|F|107231.60|1993-10-27|1-URGENT|Clerk#000000520|0|odolites. carefully quick requ
323|1|231|91|F|141554.06|1994-09-29|2-HIGH|Clerk#000000446|0| packages haggle slyly after the carefully ironic instruct
324|1|256|125|F|106315.25|1993-10-19|4-NOT SPECIFIED|Clerk#000000834|0|he fluffily final ideas might are final accounts. carefully f
325|1|257|124|O|7102.74|1998-03-28|3-MEDIUM|Clerk#000000680|0|ts against the sly warhorses cajole slyly accounts
326|1|258|43|F|186669.10|1993-12-29|1-URGENT|Clerk#000000167|0|dencies. blithely quick packages cajole. ruthlessly final accounts
327|1|259|44|F|75661.70|1993-09-29|4-NOT SPECIFIED|Clerk#000000601|0|ages doubt blithely against the final foxes. carefully express deposits dazzle
328|1|260|106|O|179292.14|1996-12-10|3-MEDIUM|Clerk#000000960|0|lently regular pinto beans sleep after the slyly e
329|1|261|47|F|201003.12|1993-06-29|3-MEDIUM|Clerk#000000310|0|ully fluffily brave instructions. furiousl
330|1|262|31|O|108443.84|1995-11-25|4-NOT SPECIFIED|Clerk#000000551|0|l packages. blithely final pinto beans use carefu
331|1|263|118|F|79782.56|1994-05-17|2-HIGH|Clerk#000000088|0| pending instructions. blithely un
332|1|288|8|O|163794.53|1997-02-21|1-URGENT|Clerk#000000109|0|uriously final requests. even, final ideas det
333|1|289|104|O|131092.67|1997-02-10|3-MEDIUM|Clerk#000000103|0|sily. slyly special excuse
334|1|290|118|F|62814.89|1994-01-01|4-NOT SPECIFIED|Clerk#000000735|0|efully dogged deposits. furiou
335|1|291|142|F|66817.05|1994-03-13|1-URGENT|Clerk#000000923|0|dolites. carefully regular pinto beans cajol
336|1|292|23|F|30783.05|1992-01-13|2-HIGH|Clerk#000000193|0|g pinto beans will have to sleep f
337|1|293|31|F|37248.78|1992-10-02|2-HIGH|Clerk#000000629|0|re bold, ironic deposits. platelets c
338|1|294|52|F|30059.47|1993-07-16|3-MEDIUM|Clerk#000000499|0|kly according to the frays. final dolphins affix quickly 
339|1|295|19|F|89345.99|1994-09-29|2-HIGH|Clerk#000000155|0| unusual pinto beans play. regular ideas haggle
340|1|320|1|O|39835.54|1997-11-21|2-HIGH|Clerk#000000573|0|ar foxes nag blithely
341|1|321|124|F|62251.15|1993-03-21|3-MEDIUM|Clerk#000000289|0|equests run. blithely final dependencies after the deposits wake caref
342|1|322|134|F|127068.89|1992-03-19|1-URGENT|Clerk#000000158|0|fully across the slyly bold packages. packages against the quickly regular i
343|1|323|40|F|79683.42|1994-03-26|1-URGENT|Clerk#000000959|0|arefully pending foxes sleep blithely. slyly express accoun
344|1|324|106|F|26868.85|1992-03-20|1-URGENT|Clerk#000000352|0| about the ironic, regular deposits run blithely against the excuses
345|1|325|41|F|71543.41|1993-10-17|5-LOW|Clerk#000000844|0|ly sometimes pending pa
346|1|326|76|O|229165.17|1995-06-04|2-HIGH|Clerk#000000466|0| requests. furiously ironic asymptotes mold carefully alongside of the blit
347|1|327|145|P|24468.16|1995-04-17|5-LOW|Clerk#000000992|0|ng the slyly final courts. slyly even escapades eat 
348|1|352|107|F|16003.86|1994-03-08|2-HIGH|Clerk#000000932|0|ke slyly bold pinto beans. blithely regular accounts against the spe
349|1|353|2|F|179984.42|1993-12-31|5-LOW|Clerk#000000449|0| quiet ideas sleep. even instructions cajole slyly. silently spe
350|1|354|139|O|157062.70|1996-03-14|2-HIGH|Clerk#000000511|0|ly regular ideas wake across the slyly silent ideas. final deposits eat b
351|1|355|71|F|69447.25|1994-06-14|5-LOW|Clerk#000000532|0|s. sometimes regular requests cajole. regular, pending accounts a
352|1|356|148|F|162786.67|1994-06-30|4-NOT SPECIFIED|Clerk#000000944|0|as wake along the bold accounts. even, 
353|1|357|61|O|98723.11|1996-10-09|2-HIGH|Clerk#000000301|0|e blithely about the express, final accounts. quickl
354|1|358|4|F|226806.66|1993-09-20|2-HIGH|Clerk#000000392|0|l, silent instructions are slyly. silently even de
355|1|359|79|F|142891.22|1994-12-19|3-MEDIUM|Clerk#000000934|0|n dolphins. special courts above the carefully ironic requests use
356|1|384|115|F|122785.82|1992-03-03|5-LOW|Clerk#000000206|0|, even accounts use furiously packages. slyly ironic pla
357|1|385|34|O|50724.06|1996-03-22|5-LOW|Clerk#000000600|0|hless accounts unwind bold pain
358|1|386|61|F|90380.40|1995-01-25|2-HIGH|Clerk#000000648|0| haggle quickly. stealthily bold asymptotes haggle among the furiously even re
359|1|387|4|O|130647.18|1997-01-26|4-NOT SPECIFIED|Clerk#000000768|0| are carefully among the quickly even deposits. furiously silent req
360|1|388|46|F|120533.46|1992-12-16|4-NOT SPECIFIED|Clerk#000000356|0|ar foxes above the furiously ironic deposits nag slyly final reque
361|1|389|127|F|1984.14|1994-02-17|2-HIGH|Clerk#000000062|0|ing to the regular asymptotes. final, pending foxes about the blithely sil
362|1|390|103|O|168562.27|1998-04-07|5-LOW|Clerk#000000404|0|xpress asymptotes use among the regular, final pinto b
363|1|391|112|F|13282.23|1994-11-17|2-HIGH|Clerk#000000256|0|orges thrash fluffil
364|1|416|41|F|71362.50|1993-09-27|5-LOW|Clerk#000000294|0| the accounts. fluffily bold depo
365|1|417|55|F|91982.29|1994-02-06|3-MEDIUM|Clerk#000000468|0|ironic, even packages. thinly unusual accounts sleep along the slyly unusual 
366|1|418|95|P|33124.96|1995-04-13|4-NOT SPECIFIED|Clerk#000000643|0|. furiously ironic instruc
367|1|419|118|O|111597.96|1996-10-01|3-MEDIUM|Clerk#000000376|0|osits. blithely pending theodolites boost carefully
368|1|420|91|O|198039.23|1995-10-31|4-NOT SPECIFIED|Clerk#000000756|0|leep carefully final excuses. fluffily pending requests unwind carefully above
369|1|421|40|F|1084.38|1992-02-22|5-LOW|Clerk#000000405|0|egular, even packages according to the final, un
370|1|422|74|O|106045.89|1997-05-31|4-NOT SPECIFIED|Clerk#000000049|0|aggle carefully across the accounts. regular accounts eat fluffi
371|1|423|104|O|26981.31|1996-06-01|1-URGENT|Clerk#000000674|0|quests. deposits cajole quickly. furiously bold accounts haggle q
372|1|448|149|O|114978.03|1995-08-21|3-MEDIUM|Clerk#000000597|0| regular, express foxes use blithely. quic
373|1|449|97|O|41605.63|1995-07-20|2-HIGH|Clerk#000000841|0|. furiously regular theodolites affix blithely 
374|1|450|49|P|153386.61|1995-03-05|4-NOT SPECIFIED|Clerk#000000293|0|d theodolites. boldly bold foxes since the pack
375|1|451|100|O|104664.40|1998-05-25|5-LOW|Clerk#000000048|0|nic pinto beans. theodolites poach carefully; 
376|1|452|61|O|2007.48|1997-10-14|1-URGENT|Clerk#000000498|0|t, unusual instructions above the blithely bold pint
377|1|453|46|O|216826.73|1997-05-26|5-LOW|Clerk#000000504|0|ss foxes. furiously regular ideas sleep according to t
378|1|454|49|O|23198.24|1995-12-27|5-LOW|Clerk#000000890|0|dolites sleep carefully blithely regular deposits. quickly regul
379|1|455|13|O|138010.76|1996-12-04|1-URGENT|Clerk#000000796|0| about the final platelets. dependen
380|1|480|73|F|20530.97|1993-05-08|5-LOW|Clerk#000000004|0|ealthy pinto beans. fluffily regular requests along the special sheaves wake 
381|1|481|31|F|117827.18|1992-10-08|2-HIGH|Clerk#000000230|0|ly final ideas. packages haggle fluffily
382|1|482|127|O|136634.34|1996-03-26|1-URGENT|Clerk#000000295|0|ts. deposits wake: final acco
383|1|483|35|O|39793.05|1995-07-11|2-HIGH|Clerk#000000025|0|cross the carefully final e
384|1|484|55|O|219920.62|1997-01-03|3-MEDIUM|Clerk#000000545|0|grouches use. furiously bold accounts maintain. bold, regular deposits
385|1|485|101|O|110432.76|1997-03-26|2-HIGH|Clerk#000000105|0| regular ideas nag thinly furiously s
447|1|486|52|O|185968.15|1996-03-11|4-NOT SPECIFIED|Clerk#000000803|0|riously dolphins. fluffily ironic requ
448|1|487|109|F|48502.79|1992-08-18|1-URGENT|Clerk#000000086|0|ithely unusual courts eat accordi
449|1|512|64|P|124661.48|1995-05-20|5-LOW|Clerk#000000814|0|ding requests. carefully express theodolites was quickly. furious
450|1|513|61|O|63703.92|1995-05-01|2-HIGH|Clerk#000000522|0|regular packages. pinto beans cajole carefully against the even
451|1|514|76|O|104585.77|1996-04-04|2-HIGH|Clerk#000000094|0| cajole furiously. slyly final excuses cajole. slyly special instructions 
452|1|515|142|F|153720.22|1993-08-29|4-NOT SPECIFIED|Clerk#000000700|0|eposits are furiously furiously silent pinto beans. pending pack
453|1|516|44|O|10677.86|1998-04-21|2-HIGH|Clerk#000000305|0|lar, unusual platelets are carefully. even courts sleep bold, final pinto bea
454|1|517|10|O|82197.79|1997-04-07|5-LOW|Clerk#000000359|0|slyly pending deposits cajole quickly packages. furiou
455|1|518|145|O|223537.09|1998-02-08|2-HIGH|Clerk#000000768|0| the carefully bold accounts. quickly regular excuses are
456|1|519|64|O|95731.50|1997-10-31|1-URGENT|Clerk#000000985|0|ains doze furiously against the f
457|1|544|94|F|47627.89|1993-02-17|2-HIGH|Clerk#000000145|0|the special, final accounts. dogged dolphins
458|1|545|64|O|23476.12|1995-11-07|2-HIGH|Clerk#000000537|0|as. blithely final hockey players about th
459|1|546|145|O|14790.37|1996-11-01|2-HIGH|Clerk#000000041|0|osits sleep. slyly special dolphins about the q
460|1|547|100|O|96855.29|1996-06-22|3-MEDIUM|Clerk#000000976|0|ing accounts eat. carefully regular packa
461|1|548|124|F|99088.75|1994-09-21|1-URGENT|Clerk#000000435|0|arefully express instru
462|1|549|110|F|141679.41|1992-07-13|1-URGENT|Clerk#000000196|0|ideas alongside of 
463|1|550|25|O|33123.28|1995-08-02|1-URGENT|Clerk#000000204|0|t requests. blithely 
464|1|551|91|O|46355.83|1995-05-30|1-URGENT|Clerk#000000179|0|xpress accounts boost quic
465|1|576|31|O|18307.45|1997-05-13|3-MEDIUM|Clerk#000000955|0|l requests affix regular requests. final account
466|1|577|56|F|34768.68|1994-12-19|5-LOW|Clerk#000000154|0| deposits engage stealthil
467|1|578|94|O|70392.02|1997-01-10|5-LOW|Clerk#000000281|0|e blithely even packages. slyly pending platelets bes
468|1|579|68|O|120828.12|1998-03-11|2-HIGH|Clerk#000000862|0| regular instructions. blithely even p
469|1|580|61|O|88219.12|1997-07-05|2-HIGH|Clerk#000000314|0|tegrate fluffily regular accou
470|1|581|70|O|126066.00|1997-02-23|4-NOT SPECIFIED|Clerk#000000239|0| requests. even requests use slyly. blithely ironic 
471|1|582|50|O|129004.81|1997-10-21|1-URGENT|Clerk#000000378|0|n pinto beans print a
472|1|583|49|O|127817.38|1997-03-19|3-MEDIUM|Clerk#000000792|0|efully express requests. a
473|1|608|26|O|62567.99|1996-02-28|3-MEDIUM|Clerk#000000995|0|nic waters wake slyly slyly expre
474|1|609|127|F|21088.59|1994-06-01|3-MEDIUM|Clerk#000000348|0|- ironic gifts believe furiously ca
475|1|610|52|O|175142.28|1995-08-02|1-URGENT|Clerk#000000610|0|totes. ironic, unusual packag
476|1|611|106|F|73907.63|1993-01-27|1-URGENT|Clerk#000000401|0|ounts detect furiously ac
477|1|612|82|F|145695.42|1992-10-21|3-MEDIUM|Clerk#000000759|0|boost quickly quickly final excuses. final foxes use bravely afte
478|1|613|139|O|33396.35|1995-06-18|2-HIGH|Clerk#000000172|0|ts hinder among the deposits. fluffily ironic depos
479|1|614|134|F|218116.21|1992-12-01|2-HIGH|Clerk#000000388|0| deposits! even, daring theodol
480|1|615|67|F|32890.89|1992-05-09|5-LOW|Clerk#000000388|0|t to promise asymptotes. packages haggle alongside of the fluffil
481|1|640|97|F|145495.62|1993-01-23|2-HIGH|Clerk#000000433|0|r, unusual accounts boost carefully final ideas. slyly silent theod
482|1|641|133|F|120626.49|1993-08-30|5-LOW|Clerk#000000175|0|ents cajole furiously about the quickly silent pac
483|1|642|40|F|22994.51|1993-12-16|3-MEDIUM|Clerk#000000357|0| among the requests wake slyly alongside of th
484|1|643|58|P|180396.95|1995-03-25|2-HIGH|Clerk#000000354|0|g dependencies. regular accounts 
485|1|644|8|F|201268.06|1992-05-01|1-URGENT|Clerk#000000550|0| blithely unusual platelets haggle ironic, special excuses. excuses unwi
486|1|645|115|F|234763.73|1994-12-03|2-HIGH|Clerk#000000090|0|quickly daring theodolites across the regu
487|1|646|52|F|142070.65|1994-11-22|2-HIGH|Clerk#000000203|0|carefully even foxes. fina
488|1|647|143|O|56449.23|1997-08-07|1-URGENT|Clerk#000000270|0|egular pearls. carefully express asymptotes are. even account
489|1|672|109|F|89877.09|1994-04-14|5-LOW|Clerk#000000106|0|egular requests are furiously according to 
490|1|673|80|F|21137.08|1994-03-10|1-URGENT|Clerk#000000448|0| special pinto beans use quickly furiously even depende
491|1|674|34|F|27204.60|1992-08-29|5-LOW|Clerk#000000448|0|ully special deposits. furiously final warhorses affix carefully. fluffily f
492|1|675|13|O|125188.72|1997-07-31|2-HIGH|Clerk#000000168|0|ffily between the careful
493|1|676|38|O|163966.67|1996-12-13|2-HIGH|Clerk#000000248|0|the final deposits. special, pending
494|1|677|124|F|147915.68|1993-11-24|3-MEDIUM|Clerk#000000824|0|uriously special pinto beans cajole carefully. fi
495|1|678|131|F|135761.05|1993-02-27|5-LOW|Clerk#000000530|0|. blithely final somas about the
496|1|679|49|O|8945.03|1995-12-15|2-HIGH|Clerk#000000853|0|tealthy, final pinto beans haggle slyly. pending platelets about the special, 
497|1|704|85|O|56210.26|1996-11-21|3-MEDIUM|Clerk#000000682|0|blithely pending platelets wake alongside of the final, iron
498|1|705|43|O|83773.49|1997-02-13|4-NOT SPECIFIED|Clerk#000000294|0|ithely regular dependencies. express, even packages sleep slyly pending t
499|1|706|148|O|23973.60|1995-09-09|1-URGENT|Clerk#000000448|0|g the packages. deposits caj
500|1|707|118|F|58218.35|1994-11-20|3-MEDIUM|Clerk#000000199|0| ideas about the silent, bold deposits nag dolphins
501|1|708|32|O|100445.59|1998-07-03|3-MEDIUM|Clerk#000000101|0|lphins cajole about t
502|1|709|37|O|72055.87|1998-04-21|1-URGENT|Clerk#000000461|0|ons alongside of the carefully bold pinto bea
503|1|710|133|F|208974.42|1993-01-02|5-LOW|Clerk#000000026|0| regular, regular requests boost. fluffily re
504|1|711|64|F|92484.70|1993-09-23|4-NOT SPECIFIED|Clerk#000000856|0|its. fluffily regular gifts are furi
505|1|736|47|O|130204.17|1998-06-21|5-LOW|Clerk#000000881|0|refully of the final pi
506|1|737|121|F|12984.85|1992-04-26|5-LOW|Clerk#000000233|0|ake blithely express, ironic theodolites. blithely special accounts wa
507|1|738|22|F|114145.18|1993-03-02|4-NOT SPECIFIED|Clerk#000000669|0|ly even foxes. furiously regular accounts cajole ca
508|1|739|1|O|159171.69|1998-05-31|5-LOW|Clerk#000000900|0| against the slyly ironic packages nag slyly ironic
509|1|740|44|O|83490.99|1995-07-16|3-MEDIUM|Clerk#000000583|0|courts haggle furiously across the final, regul
510|1|741|106|O|47985.98|1998-07-07|2-HIGH|Clerk#000000295|0|ic instructions. slyly express instructions solv
511|1|742|103|F|207632.55|1994-12-23|5-LOW|Clerk#000000543|0|equests? slyly ironic dolphins boost carefully above the blithely
512|1|743|79|O|23614.89|1996-10-04|4-NOT SPECIFIED|Clerk#000000933|0|eans. furiously ironic deposits sleep carefully carefully qui
513|1|768|98|O|220636.82|1996-08-20|3-MEDIUM|Clerk#000000411|0|jole slyly ironic packages. slyly even idea
514|1|769|80|F|43092.76|1993-06-02|3-MEDIUM|Clerk#000000172|0|ggle furiously. ironic packages haggle slyly. bold platelets affix s
515|1|770|32|O|64271.75|1998-05-23|5-LOW|Clerk#000000572|0|heodolites. furiously special pinto beans cajole pac
516|1|771|46|O|105302.05|1995-06-17|1-URGENT|Clerk#000000105|0|s. furiously final instructions across the deposit
593|1|772|97|F|128234.96|1993-04-17|2-HIGH|Clerk#000000430|0|s boost blithely fluffily idle ideas? fluffily even pin
594|1|773|133|F|146862.27|1993-09-26|3-MEDIUM|Clerk#000000307|0|tions are quickly accounts. accounts use bold, even pinto beans. gifts ag
595|1|774|80|O|145857.60|1995-12-04|1-URGENT|Clerk#000000883|0|tealthily even depths
596|1|775|134|F|59455.61|1995-03-18|1-URGENT|Clerk#000000191|0|kly express requests. fluffily silent accounts poach furiously
731|1|800|56|O|87892.38|1998-07-14|2-HIGH|Clerk#000000213|0|y alongside of the pending packages? final platelets nag fluffily carefu
732|1|801|118|F|127717.72|1992-02-18|1-URGENT|Clerk#000000186|0|iously from the furiously enticing reques
733|1|802|137|F|156381.95|1995-01-05|1-URGENT|Clerk#000000516|0|posits. ironic, pending requests cajole. even theodol
734|1|803|16|O|27629.66|1997-04-29|5-LOW|Clerk#000000260|0|ic instructions. even deposits haggle furiously at the deposits-- regular de
735|1|804|50|F|94400.43|1993-03-12|3-MEDIUM|Clerk#000000931|0|s. blithely final foxes are about the packag
736|1|805|127|O|90042.41|1995-07-05|4-NOT SPECIFIED|Clerk#000000856|0|y according to the fluffily 
737|1|806|131|O|26839.16|1996-06-20|2-HIGH|Clerk#000000240|0| the ironic packages wake carefully fina
738|1|807|145|F|222392.53|1993-11-24|3-MEDIUM|Clerk#000000012|0|refully special tithes. blithely regular accoun
739|1|832|29|F|68494.08|1992-04-19|5-LOW|Clerk#000000495|0|xes. bravely regular packages sleep up the furiously bold accou
740|1|833|56|F|49033.69|1994-02-13|3-MEDIUM|Clerk#000000437|0|ts haggle quickly across the slyl
741|1|834|43|F|46459.92|1994-05-23|3-MEDIUM|Clerk#000000805|0| sleep. quickly even foxes are boldly. slyly express requests use slyly
742|1|835|65|O|62430.67|1995-10-08|4-NOT SPECIFIED|Clerk#000000416|0|s about the carefully special foxes haggle quickly about the
743|1|836|70|O|72843.48|1996-11-25|4-NOT SPECIFIED|Clerk#000000729|0|ely bold excuses sleep regular ideas. furiously unusual ideas wake furiou
744|1|837|116|F|60918.41|1994-06-15|4-NOT SPECIFIED|Clerk#000000563|0|kages sleep slyly above the ironic, final orbits
745|1|838|17|O|82918.36|1998-01-29|5-LOW|Clerk#000000213|0| slyly around the slyly even
746|1|839|28|O|70182.63|1995-08-08|1-URGENT|Clerk#000000951|0|the carefully even platelets. furiously unusual fo
747|1|864|139|O|74710.74|1997-08-17|1-URGENT|Clerk#000000036|0|ly after the slyly regular deposits. express, regular asymptotes nag ca
748|1|865|4|F|70430.54|1993-05-04|3-MEDIUM|Clerk#000000337|0|. special packages wake after the carefully final accounts. express pinto be
749|1|866|40|F|4766.19|1992-11-28|3-MEDIUM|Clerk#000000718|0|ins after the even, even accounts nod blithel
750|1|867|26|F|7471.75|1993-11-16|3-MEDIUM|Clerk#000000877|0|pades nag quickly final, 
751|1|868|104|F|127345.45|1992-06-09|4-NOT SPECIFIED|Clerk#000000782|0|onic theodolites print carefully. blithely dogge
752|1|869|136|O|58932.19|1997-01-12|2-HIGH|Clerk#000000245|0|ar sheaves are slowly. slyly even attainments boost theodolites. furiously
753|1|870|34|F|40492.37|1993-06-20|4-NOT SPECIFIED|Clerk#000000123|0|blithely ironic ideas nod. sly, r
754|1|871|16|O|172861.58|1995-11-15|5-LOW|Clerk#000000882|0|oss the ironic theodolites.
755|1|896|2|F|169847.63|1993-03-09|1-URGENT|Clerk#000000187|0|inal packages eat blithely according to the warhorses. furiously quiet de
756|1|897|49|P|57697.44|1995-03-20|1-URGENT|Clerk#000000316|0| wake quickly against 
757|1|898|55|F|101020.75|1993-06-03|2-HIGH|Clerk#000000611|0|. unusual pinto beans haggle quickly across 
758|1|899|109|O|125562.09|1998-04-08|5-LOW|Clerk#000000575|0|rts engage carefully final theodolites.
759|1|900|46|F|120073.51|1994-10-01|4-NOT SPECIFIED|Clerk#000000060|0| fluffily express deposits nag furiousl
760|1|901|13|O|81826.12|1998-07-21|4-NOT SPECIFIED|Clerk#000000929|0|lyly even foxes are furious, silent requests. requests about the quickly 
