1026|0|1634|70|O|145898.47|1996-09-10|1-URGENT|Clerk#000000360|0|arefully blithely ironic requests. slyly unusual instructions alongside
1027|1|1984|52|O|79230.47|1998-04-01|1-URGENT|Clerk#000000416|0| slyly special instructions. unusual foxes use packages. carefully regular req
1027|0|1383|121|F|34797.72|1993-04-27|2-HIGH|Clerk#000000785|0|ts. express requests sleep blithel
1028|1|1985|7|F|171522.54|1994-09-02|4-NOT SPECIFIED|Clerk#000000741|0|slyly slyly even pains. slyly reg
1028|0|998|32|F|65269.38|1994-11-26|4-NOT SPECIFIED|Clerk#000000956|0|ronic dolphins. ironic, bold ideas haggle furiously furious
1029|1|1986|149|F|34269.96|1994-05-05|2-HIGH|Clerk#000000609|0|across the theodolites. quick
1029|0|131|94|F|96596.81|1994-06-08|3-MEDIUM|Clerk#000000625|0|after the fluffily special foxes integrate s
1030|1|1987|100|F|6406.29|1994-04-30|2-HIGH|Clerk#000000652|0|gular platelets alongside 
1030|0|256|125|F|106315.25|1993-10-19|4-NOT SPECIFIED|Clerk#000000834|0|he fluffily final ideas might are final accounts. carefully f
1031|1|1988|109|O|117132.72|1995-10-06|4-NOT SPECIFIED|Clerk#000000011|0|ly ironic dolphins serve quickly busy accounts. bu
1031|0|2|79|O|40183.29|1996-12-01|1-URGENT|Clerk#000000880|0| foxes. pending accounts at the pending, silent asymptot
1032|1|1989|118|F|39263.28|1994-03-16|4-NOT SPECIFIED|Clerk#000000747|0|ely bold pinto beans ha
1032|0|100|148|O|141311.01|1998-02-28|4-NOT SPECIFIED|Clerk#000000577|0|heodolites detect slyly alongside of the ent
1033|1|1990|119|F|48781.39|1994-12-16|2-HIGH|Clerk#000000114|0|e bold patterns. always regul
1033|0|101|28|O|95591.40|1996-03-17|3-MEDIUM|Clerk#000000419|0|ding accounts above the slyly final asymptote
1034|1|1991|19|F|139854.41|1992-09-07|4-NOT SPECIFIED|Clerk#000000854|0|ing accounts can haggle at the carefully final Tiresias-- pending, regular
1034|0|547|100|O|96855.29|1996-06-22|3-MEDIUM|Clerk#000000976|0|ing accounts eat. carefully regular packa
1035|1|2016|8|O|24347.36|1996-08-16|3-MEDIUM|Clerk#000000641|0|the carefully ironic foxes. requests nag bold, r
1035|0|416|41|F|71362.50|1993-09-27|5-LOW|Clerk#000000294|0| the accounts. fluffily bold depo
1036|1|2017|101|O|70529.27|1998-05-13|3-MEDIUM|Clerk#000000427|0|nusual requests. blit
1036|0|160|83|O|86076.86|1996-12-19|4-NOT SPECIFIED|Clerk#000000342|0|thely special sauternes wake slyly of t
1037|1|2018|19|P|25007.95|1995-04-05|4-NOT SPECIFIED|Clerk#000000920|0|gular accounts wake fur
1037|0|1760|115|O|82151.12|1996-05-17|5-LOW|Clerk#000000917|0| deposits. busily regular deposits wake blithely along the furiously even re
1038|1|2019|136|F|43789.14|1992-10-23|1-URGENT|Clerk#000000565|0| furiously bold packages. fluffily fi
1038|0|322|134|F|127068.89|1992-03-19|1-URGENT|Clerk#000000158|0|fully across the slyly bold packages. packages against the quickly regular i
1039|1|2020|73|F|136162.13|1993-06-21|3-MEDIUM|Clerk#000000192|0|es. furiously regular packages above the furiously special theodolites are a
1039|0|321|124|F|62251.15|1993-03-21|3-MEDIUM|Clerk#000000289|0|equests run. blithely final dependencies after the deposits wake caref
1040|1|2021|70|O|27016.74|1995-07-15|1-URGENT|Clerk#000000155|0|ong the furiously regular requests. unusual deposits wake fluffily inside
1040|0|1410|113|O|114879.19|1997-04-12|5-LOW|Clerk#000000123|0|iously along the bravely regular dolphins. pinto beans cajole furiously sp
1041|1|2022|62|F|206742.11|1992-03-15|1-URGENT|Clerk#000000268|0| dependencies sleep fluffily even, ironic deposits. express, silen
1041|0|645|115|F|234763.73|1994-12-03|2-HIGH|Clerk#000000090|0|quickly daring theodolites across the regu
1042|1|2023|118|F|144123.37|1992-05-06|5-LOW|Clerk#000000137|0|ular courts engage according to the
1042|0|355|71|F|69447.25|1994-06-14|5-LOW|Clerk#000000532|0|s. sometimes regular requests cajole. regular, pending accounts a
1043|1|2048|17|F|33401.77|1993-11-15|1-URGENT|Clerk#000000934|0|s cajole after the blithely final accounts. f
1043|0|64|34|F|20065.73|1994-07-16|3-MEDIUM|Clerk#000000661|0|wake fluffily. sometimes ironic pinto beans about the dolphin
1044|1|2049|31|O|153048.74|1995-12-07|2-HIGH|Clerk#000000859|0|ly regular requests thrash blithely about the fluffily even theodolites. r
1044|0|1187|134|F|85948.02|1992-11-20|3-MEDIUM|Clerk#000000047|0|s after the furiously final deposits boost slyly under the
1045|1|2050|28|F|208517.98|1994-06-02|4-NOT SPECIFIED|Clerk#000000821|0|d accounts against the furiously regular packages use bli
1045|0|1156|133|O|217682.81|1996-10-19|1-URGENT|Clerk#000000200|0| blithely ironic dolphins. furiously pendi
1046|1|2051|40|O|87988.34|1996-03-18|4-NOT SPECIFIED|Clerk#000000333|0|ctions sleep blithely. blithely regu
1046|0|513|61|O|63703.92|1995-05-01|2-HIGH|Clerk#000000522|0|regular packages. pinto beans cajole carefully against the even
1047|1|2052|91|F|141822.19|1992-04-13|2-HIGH|Clerk#000000767|0| requests sleep around the even, even courts. ironic theodolites affix furious
1047|0|2023|118|F|144123.37|1992-05-06|5-LOW|Clerk#000000137|0|ular courts engage according to the
1048|1|2053|142|F|125125.57|1995-02-07|1-URGENT|Clerk#000000717|0|ar requests: blithely sly accounts boost carefully across t
1048|0|1443|44|O|44672.03|1996-12-16|5-LOW|Clerk#000000185|0|x blithely against the carefully final somas. even asymptotes are. quickly spe
1049|1|2054|41|F|144335.16|1992-06-08|4-NOT SPECIFIED|Clerk#000000103|0|l requests affix carefully about the furiously special
1049|0|1444|134|F|207907.60|1994-12-06|3-MEDIUM|Clerk#000000783|0|ove the bold accounts cajole fluffily about
1050|1|2055|97|F|57092.26|1993-09-04|1-URGENT|Clerk#000000067|0|. warhorses affix slyly blithely express instructions? fur
1050|0|1158|142|O|31075.51|1996-06-30|2-HIGH|Clerk#000000549|0|integrate slyly furiously ironic deposit
1051|1|2080|95|F|45767.69|1993-06-18|5-LOW|Clerk#000000190|0|ironic, pending theodolites are carefully about the quickly regular theodolite
1051|0|1728|64|O|131604.34|1996-05-22|2-HIGH|Clerk#000000711|0|beans. slyly regular instructions sleep! slyly final packages
1052|1|2081|121|O|145654.97|1997-07-05|2-HIGH|Clerk#000000136|0|ong the regular theo
1052|0|898|55|F|101020.75|1993-06-03|2-HIGH|Clerk#000000611|0|. unusual pinto beans haggle quickly across 
1053|1|2082|49|F|46753.63|1995-01-10|2-HIGH|Clerk#000000354|0|cial accounts. ironic, express dolphins nod slyly sometimes final reques
1053|0|870|34|F|40492.37|1993-06-20|4-NOT SPECIFIED|Clerk#000000123|0|blithely ironic ideas nod. sly, r
1054|1|2083|101|F|31795.52|1993-07-14|3-MEDIUM|Clerk#000000361|0|al patterns. bold, final foxes nag bravely about the furiously express
1054|0|293|31|F|37248.78|1992-10-02|2-HIGH|Clerk#000000629|0|re bold, ironic deposits. platelets c
1055|1|2084|80|F|190652.53|1993-03-17|2-HIGH|Clerk#000000048|0|zle furiously final, careful packages. slyly ironic ideas amo
1055|0|1570|124|O|35589.57|1998-03-16|1-URGENT|Clerk#000000745|0|pinto beans haggle furiousl
1056|1|2085|49|F|45311.07|1993-11-21|3-MEDIUM|Clerk#000000818|0|ress, express ideas haggle
1056|0|516|44|O|10677.86|1998-04-21|2-HIGH|Clerk#000000305|0|lar, unusual platelets are carefully. even courts sleep bold, final pinto bea
1057|1|2086|142|F|188985.18|1994-10-19|1-URGENT|Clerk#000000046|0| permanently regular
1057|0|544|94|F|47627.89|1993-02-17|2-HIGH|Clerk#000000145|0|the special, final accounts. dogged dolphins
1058|1|2087|50|O|53581.41|1998-01-31|2-HIGH|Clerk#000000626|0|e always regular packages nod against the furiously spec
1058|0|1797|125|O|51494.47|1996-05-07|3-MEDIUM|Clerk#000000508|0|quiet platelets haggle since the quickly ironic instructi
1059|1|2112|64|O|17986.15|1997-02-05|2-HIGH|Clerk#000000351|0|against the slyly even id
1059|0|1568|17|O|76119.72|1997-01-30|4-NOT SPECIFIED|Clerk#000000554|0|d notornis. carefully 
1060|1|2113|32|O|65678.21|1997-11-08|2-HIGH|Clerk#000000527|0|slyly regular instruct
1060|0|1411|95|F|164462.61|1994-12-21|2-HIGH|Clerk#000000566|0|s. furiously special excuses across the pending pinto beans haggle sp
1061|1|2114|79|F|106446.02|1995-01-16|5-LOW|Clerk#000000751|0|r, unusual accounts haggle across the busy platelets. carefully 
1061|0|1028|70|F|153864.67|1994-01-01|2-HIGH|Clerk#000000131|0|ts are. final, silent deposits are among the fl
1062|1|2115|106|O|134814.65|1998-05-23|4-NOT SPECIFIED|Clerk#000000101|0|odolites boost. carefully regular excuses cajole. quickly ironic pinto be
1062|0|1413|91|O|75733.58|1997-06-14|3-MEDIUM|Clerk#000000342|0|, ironic instructions. carefully even packages dazzle
1063|1|2116|23|F|60887.90|1994-08-26|1-URGENT|Clerk#000000197|0|efully after the asymptotes. furiously sp
1063|0|967|110|F|179287.95|1992-06-21|3-MEDIUM|Clerk#000000167|0|excuses engage quickly bold dep
1064|1|2117|22|O|145713.03|1997-04-26|2-HIGH|Clerk#000000887|0|ely even dependencies. regular foxes use blithely.
1064|0|1508|103|O|151282.65|1998-04-10|5-LOW|Clerk#000000117|0| after the furiously regular pinto beans hang slyly quickly ironi
1065|1|2118|134|O|38974.67|1996-10-09|1-URGENT|Clerk#000000196|0|ial requests wake carefully special packages. f
1065|0|581|70|O|126066.00|1997-02-23|4-NOT SPECIFIED|Clerk#000000239|0| requests. even requests use slyly. blithely ironic 
1066|1|2119|64|O|34632.57|1996-08-20|2-HIGH|Clerk#000000434|0|uickly pending escapades. fluffily ir
1066|0|1313|148|F|46598.65|1994-09-13|1-URGENT|Clerk#000000774|0|ld accounts. regular deposits cajole. ironically pending theodolites use car
1067|1|2144|136|F|119917.28|1994-03-29|3-MEDIUM|Clerk#000000546|0|t. carefully quick requests across the deposits wake regu
1067|0|1796|47|F|33755.47|1992-11-21|2-HIGH|Clerk#000000245|0|eans use furiously around th
1068|1|2145|134|F|18885.35|1992-10-03|1-URGENT|Clerk#000000886|0|sts would snooze blithely alongside of th
1068|0|2053|142|F|125125.57|1995-02-07|1-URGENT|Clerk#000000717|0|ar requests: blithely sly accounts boost carefully across t
1069|1|2146|118|F|179686.07|1992-09-14|4-NOT SPECIFIED|Clerk#000000476|0|ven packages. dependencies wake slyl
1069|0|1381|127|O|58212.22|1998-05-25|3-MEDIUM|Clerk#000000107|0|even requests breach after the bold, ironic instructions. slyly even
1070|1|2147|100|F|91513.79|1992-09-06|4-NOT SPECIFIED|Clerk#000000424|0| haggle carefully furiously final foxes. pending escapades thrash. bold theod
1070|0|610|52|O|175142.28|1995-08-02|1-URGENT|Clerk#000000610|0|totes. ironic, unusual packag
1071|1|2148|130|F|19612.03|1995-04-19|4-NOT SPECIFIED|Clerk#000000517|0|ross the furiously unusual theodolites. always expre
1071|0|1345|95|F|111207.93|1992-10-28|5-LOW|Clerk#000000447|0| regular tithes. quickly fluffy de
1072|1|2149|101|F|105145.40|1993-03-13|5-LOW|Clerk#000000555|0|nusual accounts nag furiously special reques
1072|0|98|106|F|51004.44|1994-09-25|1-URGENT|Clerk#000000448|0|c asymptotes. quickly regular packages should have to nag re
1073|1|2150|82|F|166961.06|1994-06-03|3-MEDIUM|Clerk#000000154|0|ect slyly against the even, final packages. quickly regular pinto beans wake c
1073|0|1573|148|F|86918.57|1992-12-28|2-HIGH|Clerk#000000940|0|ess, ironic deposits use along the carefu
1074|1|2151|58|O|124608.69|1996-11-11|3-MEDIUM|Clerk#000000996|0|c requests. ironic platelets cajole across the quickly fluffy deposits.
1074|0|1509|64|F|180455.98|1993-07-08|5-LOW|Clerk#000000770|0|the regular ideas. regul
1075|1|2176|104|F|87248.17|1992-11-10|1-URGENT|Clerk#000000195|0|s haggle regularly accor
1075|0|1252|149|O|93403.05|1997-08-04|5-LOW|Clerk#000000348|0|ng the slyly regular excuses. special courts nag furiously blithely e
1076|1|2177|136|O|183493.42|1997-01-20|3-MEDIUM|Clerk#000000161|0|ove the blithely unusual packages cajole carefully fluffily special request
1076|0|1504|2|F|89399.40|1992-08-28|3-MEDIUM|Clerk#000000381|0|, brave deposits. bold de
1077|1|2178|8|O|79594.68|1996-12-12|3-MEDIUM|Clerk#000000656|0|thely according to the instructions. furious
1077|0|2118|134|O|38974.67|1996-10-09|1-URGENT|Clerk#000000196|0|ial requests wake carefully special packages. f
1078|1|2179|41|O|77487.09|1996-09-07|2-HIGH|Clerk#000000935|0|ounts alongside of the furiously unusual braids cajol
1078|0|259|44|F|75661.70|1993-09-29|4-NOT SPECIFIED|Clerk#000000601|0|ages doubt blithely against the final foxes. carefully express deposits dazzle
1079|1|2180|76|O|208481.57|1996-09-14|4-NOT SPECIFIED|Clerk#000000650|0|xpress, unusual pains. furiously ironic excu
1079|0|515|142|F|153720.22|1993-08-29|4-NOT SPECIFIED|Clerk#000000700|0|eposits are furiously furiously silent pinto beans. pending pack
1080|1|2181|76|O|100954.64|1995-09-13|3-MEDIUM|Clerk#000000814|0|y against the ironic, even
1080|0|2177|136|O|183493.42|1997-01-20|3-MEDIUM|Clerk#000000161|0|ove the blithely unusual packages cajole carefully fluffily special request
1081|1|2182|23|F|116003.11|1994-04-05|2-HIGH|Clerk#000000071|0|ccounts. quickly bold deposits across the excuses sl
1081|0|2119|64|O|34632.57|1996-08-20|2-HIGH|Clerk#000000434|0|uickly pending escapades. fluffily ir
1082|1|2183|113|O|49841.12|1996-06-22|1-URGENT|Clerk#000000287|0| among the express, ironic packages. slyly ironic platelets integrat
1082|0|1123|73|O|93259.93|1996-08-03|3-MEDIUM|Clerk#000000929|0|uriously pending requests. slyly regular instruction
1083|1|2208|68|P|245388.06|1995-05-01|4-NOT SPECIFIED|Clerk#000000900|0|symptotes wake slyly blithely unusual packages.
1083|0|2084|80|F|190652.53|1993-03-17|2-HIGH|Clerk#000000048|0|zle furiously final, careful packages. slyly ironic ideas amo
1084|1|2209|91|F|129086.93|1992-07-10|2-HIGH|Clerk#000000056|0|er above the slyly silent requests. furiously reg
1084|0|1537|109|F|108317.51|1992-02-15|4-NOT SPECIFIED|Clerk#000000862|0|g to the even deposits. ironic, final packages 
1085|1|2210|32|F|31689.46|1992-01-16|2-HIGH|Clerk#000000941|0| believe carefully quickly express pinto beans. deposi
1085|0|1670|25|O|89999.72|1997-05-24|2-HIGH|Clerk#000000320|0|unusual dependencies. furiously special platelets main
1086|1|2211|92|F|140031.23|1994-06-30|2-HIGH|Clerk#000000464|0|ffily bold courts e
1086|0|258|43|F|186669.10|1993-12-29|1-URGENT|Clerk#000000167|0|dencies. blithely quick packages cajole. ruthlessly final accounts
1087|1|2212|118|F|17231.05|1994-03-23|3-MEDIUM|Clerk#000000954|0|structions above the unusual requests use fur
1087|0|1286|109|F|207291.83|1993-05-14|4-NOT SPECIFIED|Clerk#000000939|0| deposits use carefully from the excuses. slyly bold p
1088|1|2213|122|F|146136.10|1993-01-15|4-NOT SPECIFIED|Clerk#000000598|0|osits are carefully reg
1088|0|387|4|O|130647.18|1997-01-26|4-NOT SPECIFIED|Clerk#000000768|0| are carefully among the quickly even deposits. furiously silent req
1089|1|2214|115|O|150345.63|1998-05-05|3-MEDIUM|Clerk#000000253|0|packages. fluffily even accounts haggle blithely. carefully ironic depen
1089|0|1991|19|F|139854.41|1992-09-07|4-NOT SPECIFIED|Clerk#000000854|0|ing accounts can haggle at the carefully final Tiresias-- pending, regular
1090|1|2215|40|O|108239.46|1996-06-16|4-NOT SPECIFIED|Clerk#000000817|0|le final, final foxes. quickly regular gifts are carefully deposit
1090|0|2050|28|F|208517.98|1994-06-02|4-NOT SPECIFIED|Clerk#000000821|0|d accounts against the furiously regular packages use bli
1091|1|2240|56|F|174090.30|1992-03-06|4-NOT SPECIFIED|Clerk#000000622|0|accounts against the slyly express foxes are after the slyly regular 
1091|0|2087|50|O|53581.41|1998-01-31|2-HIGH|Clerk#000000626|0|e always regular packages nod against the furiously spec
1092|1|2241|103|F|165219.08|1993-05-11|1-URGENT|Clerk#000000081|0|y about the silent excuses. furiously ironic instructions along the sil
1092|0|1703|134|F|121220.59|1993-01-28|3-MEDIUM|Clerk#000000463|0| pinto beans poach. bold courts boost. regular, express deposits at
1093|1|2242|82|O|15082.82|1997-07-20|4-NOT SPECIFIED|Clerk#000000360|0| pending multipliers. carefully express asymptotes use quickl
1093|0|230|103|F|107231.60|1993-10-27|1-URGENT|Clerk#000000520|0|odolites. carefully quick requ
1094|1|2243|49|O|10451.97|1995-06-10|2-HIGH|Clerk#000000813|0|ously regular deposits integrate s
1094|0|134|7|F|154260.84|1992-05-01|4-NOT SPECIFIED|Clerk#000000711|0|lar theodolites boos
1095|1|2244|127|F|21207.08|1993-01-09|1-URGENT|Clerk#000001000|0|ckages. ironic, ironic accounts haggle blithely express excuses. 
1095|0|1382|133|F|173522.71|1993-08-17|5-LOW|Clerk#000000241|0|fully final packages sl
1096|1|2245|58|F|150585.73|1993-04-28|3-MEDIUM|Clerk#000000528|0|ake carefully. braids haggle slyly quickly b
1096|0|197|34|P|100290.07|1995-04-07|2-HIGH|Clerk#000000969|0|solve quickly about the even braids. carefully express deposits affix care
1097|1|2246|113|O|85755.84|1996-05-27|4-NOT SPECIFIED|Clerk#000000739|0| final gifts sleep 
1097|0|67|58|O|116227.05|1996-12-19|4-NOT SPECIFIED|Clerk#000000547|0|symptotes haggle slyly around the furiously iron
1098|1|2247|95|F|13491.31|1992-08-02|4-NOT SPECIFIED|Clerk#000000947|0|furiously regular packages. final brai
1098|0|549|110|F|141679.41|1992-07-13|1-URGENT|Clerk#000000196|0|ideas alongside of 
1099|1|2272|139|F|127934.71|1993-04-13|2-HIGH|Clerk#000000449|0|s. bold, ironic pinto beans wake. silently specia
1099|0|2081|121|O|145654.97|1997-07-05|2-HIGH|Clerk#000000136|0|ong the regular theo
1100|1|2273|136|O|142291.79|1996-12-14|5-LOW|Clerk#000000155|0|uickly express foxes haggle quickly against
1100|0|323|40|F|79683.42|1994-03-26|1-URGENT|Clerk#000000959|0|arefully pending foxes sleep blithely. slyly express accoun
1101|1|2274|104|F|58273.89|1993-09-04|4-NOT SPECIFIED|Clerk#000000258|0|nstructions try to hag
1101|0|1699|85|F|66408.29|1993-12-30|1-URGENT|Clerk#000000125|0|jole blithely. furiously un
1102|1|2275|149|F|37398.90|1992-10-22|4-NOT SPECIFIED|Clerk#000000206|0| furiously furious platelets. slyly final packa
1102|0|1319|32|O|31103.83|1996-09-27|2-HIGH|Clerk#000000257|0|y across the ruthlessly ironic accounts. unusu
1103|1|2276|43|O|141159.63|1996-04-29|4-NOT SPECIFIED|Clerk#000000821|0|ecial requests. fox
1103|0|2048|17|F|33401.77|1993-11-15|1-URGENT|Clerk#000000934|0|s cajole after the blithely final accounts. f
1104|1|2277|89|F|79270.23|1995-01-02|4-NOT SPECIFIED|Clerk#000000385|0|accounts cajole. even i
1104|0|1701|130|F|72835.95|1992-05-19|2-HIGH|Clerk#000000395|0|furiously. regular, close theodoli
1105|1|2278|142|O|101878.46|1998-04-25|3-MEDIUM|Clerk#000000186|0|r pinto beans integrate after the carefully even deposits. blit
1105|0|2147|100|F|91513.79|1992-09-06|4-NOT SPECIFIED|Clerk#000000424|0| haggle carefully furiously final foxes. pending escapades thrash. bold theod
1106|1|2279|80|F|142322.33|1993-02-23|3-MEDIUM|Clerk#000000898|0|de of the quickly unusual instructio
1106|0|2021|70|O|27016.74|1995-07-15|1-URGENT|Clerk#000000155|0|ong the furiously regular requests. unusual deposits wake fluffily inside
1107|1|2304|46|F|93769.28|1994-01-07|4-NOT SPECIFIED|Clerk#000000415|0|onic platelets. ironic packages haggle. packages nag doggedly according to
1107|0|1923|136|O|171128.10|1997-07-07|1-URGENT|Clerk#000000471|0| express dolphins. 
1108|1|2305|43|F|122964.66|1993-01-26|2-HIGH|Clerk#000000440|0|ove the furiously even acco
1108|0|1632|67|O|183286.33|1997-01-08|3-MEDIUM|Clerk#000000351|0|onic requests are accounts. bold a
1109|1|2306|28|O|244704.23|1995-07-26|2-HIGH|Clerk#000000975|0| wake furiously requests. permanent requests affix. final packages caj
1109|0|1856|106|F|189361.42|1992-03-20|4-NOT SPECIFIED|Clerk#000000952|0|. special pinto beans run acr
1110|1|2307|106|F|59417.76|1993-06-29|5-LOW|Clerk#000000952|0|furiously even asymptotes? carefully regular accounts
1110|0|1889|25|O|96431.77|1997-03-16|1-URGENT|Clerk#000000854|0|p around the regular notornis. unusual deposits
1111|1|2308|25|F|58546.02|1992-10-25|4-NOT SPECIFIED|Clerk#000000609|0|ts. slyly final depo
1111|0|1956|127|F|88704.26|1992-09-20|4-NOT SPECIFIED|Clerk#000000600|0|ironic ideas are silent ideas. furiously final deposits sleep slyly carefu
1112|1|2309|100|O|146933.07|1995-09-04|5-LOW|Clerk#000000803|0|he carefully pending packages. fluffily stealthy foxes engage carefully
1112|0|1988|109|O|117132.72|1995-10-06|4-NOT SPECIFIED|Clerk#000000011|0|ly ironic dolphins serve quickly busy accounts. bu
1113|1|2310|31|O|82928.12|1996-09-20|5-LOW|Clerk#000000917|0|wake carefully. unusual instructions nag ironic, regular excuse
1113|0|1888|121|F|224724.11|1993-10-31|4-NOT SPECIFIED|Clerk#000000659|0|olites. pinto beans cajole. regular deposits affix. slyly regular
1114|1|2311|73|P|153233.93|1995-05-02|2-HIGH|Clerk#000000761|0|ly pending asymptotes-- furiously bold excus
1114|0|164|1|F|202660.52|1992-10-21|5-LOW|Clerk#000000209|0|cajole ironic courts. slyly final ideas are slyly. blithely final Tiresias sub
1115|1|2336|142|O|22294.51|1996-01-07|4-NOT SPECIFIED|Clerk#000000902|0|c, final excuses sleep furiously among the even theodolites. f
1115|0|1185|74|F|47033.21|1992-08-24|5-LOW|Clerk#000000344|0| even escapades are. package
1116|1|2337|142|O|45704.96|1997-06-18|4-NOT SPECIFIED|Clerk#000000754|0| quickly. final accounts haggle. carefully final acco
1116|0|1859|61|O|105094.09|1997-04-11|4-NOT SPECIFIED|Clerk#000000949|0| the foxes. bravely special excuses nag carefully special r
1117|1|2338|140|O|28155.92|1997-09-15|2-HIGH|Clerk#000000951|0|riously final dugouts. final, ironic packages wake express, ironic id
1117|0|1633|16|O|52359.51|1995-10-14|2-HIGH|Clerk#000000666|0|y silent accounts sl
1118|1|2339|109|F|63470.78|1993-12-15|5-LOW|Clerk#000000847|0| against the regular 
1118|0|228|46|F|2638.98|1993-02-25|1-URGENT|Clerk#000000562|0|es was slyly among the regular foxes. blithely regular dependenci
1119|1|2340|65|O|30778.78|1996-01-12|1-URGENT|Clerk#000000964|0|ter the deposits sleep according to the slyly regular packages. carefully 
1119|0|2304|46|F|93769.28|1994-01-07|4-NOT SPECIFIED|Clerk#000000415|0|onic platelets. ironic packages haggle. packages nag doggedly according to
1120|1|2341|82|F|55950.21|1993-05-30|5-LOW|Clerk#000000443|0|sts-- blithely bold dolphins through the deposits nag blithely carefully re
1120|0|2086|142|F|188985.18|1994-10-19|1-URGENT|Clerk#000000046|0| permanently regular
1121|1|2342|37|O|104038.78|1996-06-09|1-URGENT|Clerk#000000615|0|oost carefully across the regular accounts. blithely final d
1121|0|291|142|F|66817.05|1994-03-13|1-URGENT|Clerk#000000923|0|dolites. carefully regular pinto beans cajol
1122|1|2343|73|O|85381.00|1995-08-21|3-MEDIUM|Clerk#000000170|0|fluffily over the slyly special deposits. quickl
1122|0|288|8|O|163794.53|1997-02-21|1-URGENT|Clerk#000000109|0|uriously final requests. even, final ideas det
1123|1|2368|13|F|101240.96|1993-08-20|1-URGENT|Clerk#000000830|0|t the bold instructions. carefully unusual 
1123|0|866|40|F|4766.19|1992-11-28|3-MEDIUM|Clerk#000000718|0|ins after the even, even accounts nod blithel
1124|1|2369|110|O|73517.91|1996-12-24|2-HIGH|Clerk#000000752|0|iously even requests are dogged, express 
1124|0|1990|119|F|48781.39|1994-12-16|2-HIGH|Clerk#000000114|0|e bold patterns. always regul
1125|1|2370|142|F|73924.21|1994-01-17|1-URGENT|Clerk#000000231|0|lyly final packages. quickly final deposits haggl
1125|0|834|43|F|46459.92|1994-05-23|3-MEDIUM|Clerk#000000805|0| sleep. quickly even foxes are boldly. slyly express requests use slyly
1126|1|2371|19|O|193857.67|1998-01-07|1-URGENT|Clerk#000000028|0|ckages haggle at th
1126|0|1766|139|O|41032.81|1996-10-12|2-HIGH|Clerk#000000983|0|unusual deposits affix quickly beyond the carefully s
1127|1|2372|31|O|104927.66|1997-11-21|5-LOW|Clerk#000000342|0|s: deposits haggle along the final ideas. careful
1127|0|2017|101|O|70529.27|1998-05-13|3-MEDIUM|Clerk#000000427|0|nusual requests. blit
1128|1|2373|28|F|55211.04|1994-03-12|4-NOT SPECIFIED|Clerk#000000306|0| even, special courts grow quickly. pending,
1128|0|2116|23|F|60887.90|1994-08-26|1-URGENT|Clerk#000000197|0|efully after the asymptotes. furiously sp
1129|1|2374|4|F|115219.88|1993-10-29|4-NOT SPECIFIED|Clerk#000000081|0| blithely regular packages. blithely unusua
1129|0|2306|28|O|244704.23|1995-07-26|2-HIGH|Clerk#000000975|0| wake furiously requests. permanent requests affix. final packages caj
1130|1|2375|5|O|106612.48|1996-11-20|3-MEDIUM|Clerk#000000197|0|unusual, pending theodolites cajole carefully 
1130|0|1924|76|O|169756.19|1996-09-07|4-NOT SPECIFIED|Clerk#000000823|0| of the ironic accounts. instructions near the final instr
1131|1|2400|37|O|92798.66|1998-07-25|5-LOW|Clerk#000000782|0|nusual courts nag against the carefully unusual pinto b
1131|0|2244|127|F|21207.08|1993-01-09|1-URGENT|Clerk#000001000|0|ckages. ironic, ironic accounts haggle blithely express excuses. 
1132|1|2401|148|O|88448.24|1997-07-29|4-NOT SPECIFIED|Clerk#000000531|0|ully unusual instructions boost carefully silently regular requests. 
1132|0|966|14|O|120516.93|1998-04-30|2-HIGH|Clerk#000000239|0|special deposits. furious
1133|1|2402|67|O|70403.62|1996-09-06|4-NOT SPECIFIED|Clerk#000000162|0|slyly final sheaves sleep slyly. q
1133|0|1380|137|O|94969.41|1996-07-07|3-MEDIUM|Clerk#000000969|0|inal deposits wake slyly daringly even requests. bold, even foxe
1134|1|2403|55|O|111020.79|1998-04-11|3-MEDIUM|Clerk#000000820|0|furiously regular deposits use. furiously unusual accounts wake along the 
1134|0|2337|142|O|45704.96|1997-06-18|4-NOT SPECIFIED|Clerk#000000754|0| quickly. final accounts haggle. carefully final acco
1135|1|2404|77|O|109077.69|1997-03-13|4-NOT SPECIFIED|Clerk#000000409|0|deposits breach furiously. ironic foxes haggle carefully bold packag
1135|0|1829|112|F|127532.20|1994-05-08|2-HIGH|Clerk#000000537|0| accounts wake above the furiously unusual requests. pending package
1136|1|2405|73|O|115929.14|1996-12-23|3-MEDIUM|Clerk#000000535|0|ular, regular asympto
1136|0|2179|41|O|77487.09|1996-09-07|2-HIGH|Clerk#000000935|0|ounts alongside of the furiously unusual braids cajol
1137|1|2406|7|O|182516.77|1996-10-28|5-LOW|Clerk#000000561|0|blithely regular accounts u
1137|0|2148|130|F|19612.03|1995-04-19|4-NOT SPECIFIED|Clerk#000000517|0|ross the furiously unusual theodolites. always expre
